{"$schema":"https://json-schema.org/draft/2020-12/schema","title":"Epyllion translation entries","type":"array","items":{"type":"object","required":["id","title","en","category","kind","source","paragraphs"],"properties":{"id":{"type":"string","pattern":"^[a-z0-9-]+$"},"title":{"type":"string","minLength":1},"en":{"type":"string","minLength":1},"category":{"enum":["world","houses","creation","rules","moves","magic","shadow","growth","playbooks","playbook-moves","gm","gm-moves","first-session","hazards","examples","expansion","expansion-playbooks"]},"kind":{"enum":["譯文","摘要／索引","整理工具"]},"source":{"type":"object","required":["book","pages","file"],"properties":{"book":{"type":"string","minLength":1},"pages":{"type":"string","minLength":1},"file":{"type":"string","minLength":1}},"additionalProperties":false},"paragraphs":{"type":"array","items":{"type":"string","minLength":1}},"bullets":{"type":"array","items":{"type":"string","minLength":1}},"note":{"type":"string"},"stat":{"type":"string"},"role":{"type":"string"},"image":{"type":"string","pattern":"^assets/[^.].*"}},"additionalProperties":false}}
