[
  {
    "id":"ed-cellani-story","title":"「來個 Cellani」：月花龍群的故事","en":"Pulling a Cellani — Tales of the Moonflower Clutch","category":"expansion","kind":"譯文","source":{"book":"Encyclopedia Draconica","pages":"30–36","file":"encyclopedia"},"paragraphs":["龍族歷史學者 Agate Flamedrake 著；Brendan Conway 代表 Dana 譯錄。「若你要從雲上往下跳，下面最好有隻幼龍飛著，準備接住你。」——月花龍群的 Cellani。","所有幼龍都聽過月花龍群的故事，多半是活潑的寓言。〈月花龍群拯救天空！〉、〈月花龍群移動高山！〉、〈月花龍群與森林交朋友！〉都是好故事，但每個都誇張得遠超事實。然而，真正的月花龍群確實存在。他們確實曾以自己的方式，救天空、移高山、與森林結交。","我夠老，曾見過他們的成員；又夠年輕，尚未成為遠古龍或神祕龍，這樣的龍並不多。我寫下這些，是因為相信月花龍群的真相必須保存，以使龍域更好；也因為……他們救了我的命。","月花龍群：他們與所有幼龍龍群一樣，起於同樣的制度。略有不同的是，較年長者會積極指導年幼成員，但這也不算罕見。真正令他們出眾的，是冒險、代表議會完成的許多任務，以及非凡成就。","奉派處理不自然的怪颶風襲擊沿海洞穴聚落 Silverstream，他們發現一座遭黑暗腐化的遠古風力機，攜手淨化，帶回首都。奉派協助 Quicklet’s Aerie 建造新孵育所，他們在山底發現遠古龍蛋窖藏：整條戰前血脈，以月亮魔法保存。奉派調查蘑菇叢林原本溫馴的生物為何激躁，他們與林中的鳥蕈結盟，約定定期清除閃電藤，交換穩定供應的美味菌菇，然後將消息帶回首都。","他們對抗灌滿黑暗的可怕怪物，拯救無數幼龍，找出典籍古物，真正服務龍域。所有這些，都比寓言所能傳達的更加真實。他們的真名也與寓言不同；寓言裡多數成員都以花命名，未免太巧。正如他們是有鱗有血的真龍，也有值得尊崇的真名：Islaen、Quaoar、Bryaan、Tiker、Cellani。請記住這些名字。","Islaen 是青綠色的幼龍，翼尖最遠處點著靛藍。即使我遇見時已是長老，顏色依然鮮亮如初鱗幼龍。從我讀到的資料看，他機巧、聰敏、反應快，血液也充滿熱情；動怒快、動情快，熱衷探索，對龍域最深遠的遺跡與學識充滿好奇。","Quaoar 愛思考，身形更大、更厚重，鱗甲粗厚；不認識的人會以為那是一隻威猛強大的龍。其實他只想鑽入書本追求知識。閱讀慾無窮，不在龍群身旁時，就蜷著身讀剛從古墓救回的典籍。他專心追求知識，平時甚至忘了分享，直到龍群需要協助才想起。","Quaoar 的導師 Bryaan 教學生質疑一切、追求知識、探索理解世界；但學生偏愛書本，導師卻重視親身探索。Bryaan 想體驗世界，為發現新事多次拉 Quaoar 出征。這隻較纖細、修長、長棘的龍，因多次戰鬥滿身缺口與疤痕；他尋求戰鬥來考驗自己、變得更好、認識極限。","Tiker 是其中最純粹的戰士。巨大的紅龍，脊背與雙翼黑色，強壯、勇敢、無畏，為追求刺激而衝入危險。他深愛龍群，結交朋友很快，事實上做所有事都很快；生命圍繞速度、腎上腺素與體驗，圍繞戰鬥與興奮。","然後是 Cellani。唯一名字傳遍所有寓言的成員，龍群的心。在寓言裡，他威嚴、高貴、優雅，身形修長強健；真實雖同樣有深金屬藍鱗片與金眼睛，模樣卻大不相同。他是最小的一隻，總比實際年齡更顯年幼。寓言裡的製作、藝術、烹飪技巧倒確實都有，更重要的是，同樣的心、智慧與機靈。","Cellani 把這些迥異的龍連成一體：讓 Quaoar 走出殼，讓 Tiker 有值得關愛與為之奮戰的人，陪伴 Bryaan 最狂野的冒險，指導 Islaen、拉住他最奔放的激情。Cellani 以溫柔、耐性，以及恰好惹出適量麻煩的奇妙本領，將大家團結起來。","「來個 Cellani」：我與月花龍群見過幾次，多半匆匆擦身。我和任何龍一樣敬畏他們。雖然受到尊重，仍鼓不起勇氣說超過最簡單的客套話。直到成為歷史學者、在檔案館圖書館取得工作位置，再遇到成員時，才終於下定決心問出長年藏在心中的問題。","我最後訪談的是 Islaen。龍群已許久不活動，成員各奔前程。他不確定每位的所在，猜 Bryaan 與 Tiker 已成為一對遠古龍，永遠漫遊、體驗世界奇蹟、侍奉群月。Quaoar 成為大檔案館首席圖書管理員，始終被喜愛的書包圍，並與新一代分享這份愛。我在館內只與 Quaoar 短暫擦肩，自己的英雄崇拜使我不敢靠近。至於 Cellani……","「我願意想像 Cellani 仍在外頭，」Islaen 告訴我。「不是遠古龍或神祕龍，就是他自己，等我們再次需要他。」嘴角一抹微笑，使青綠鱗片互相堆疊、滑動。我們談了數小時的冒險。「名字來自我們曾用群月之力，復甦一整片珍貴玻璃花田。不過，飛到月亮表面摘花的故事，我也很喜歡。」他又笑了。","談起一次與甲豬獸——躁動的甲蟲野豬獸——有關的事件時，Islaen 真正容光煥發，第一次說出那句：「來個 Cellani。」","「不知什麼把甲豬獸惹毛，牠們拍著可笑的殼翼四處飛，撞樹、震落葉片。看見別的生物，就像長牙飛石般衝下。我們奉命查明為何如此不安，並處理問題。我們藏在樹枝，看牠們在前方林地衝撞，壓低聲音爭論計畫，卻怎麼也無法同意。然後 Cellani——」Islaen 笑出了聲。","「Cellani 從棲枝直射出去，衝向整群甲豬獸中最大那一隻，直視牠的眼睛，以甜甜的小聲音問：『你為什麼這麼沒禮貌？』好像所有人——甲豬獸、我們，甚至林地的樹與其他生物——都震驚得一片沉默。時間彷彿停住。接著所有人同時動起來：甲豬獸衝向 Cellani，我們衝出掩護救他，Cellani 反而往前抓住巨獸的耳朵。場面一片混亂。","「最後有個好結果。混戰中，Tiker 注意到牠們翅膀底下卡著漆黑刺果。把刺果打掉後，牠們便平靜下來。那是某種寄生的暗影種子，Bryaan 和 Quaoar 用月亮魔法將它們驅除。但真正能成功，都是因為 Cellani 衝了出去。他瘋狂衝動，卻把我們聚在一起。","「我們以為這就結束了，他該學會教訓，結果……並沒有。後來他在幽影神殿決定跟暗影松鴉一起唱歌；又直接從議員 Drixel 宅邸燈座偷走閃電藍寶石；又想騎著海巨獸越浪而行。每一次都介於笨拙、大膽、魯莽之間。每一次都把自己放進危險，也拖我們下水；每一次，都讓我們團結。","「所以我們稱它為『來個 Cellani』。做某件事，讓麻煩直接落到頭上……但最終，也因此把我們推到一起。」我聽得出他話裡的深情。我問，如果 Cellani 知道月花龍群許多真實事蹟，連真名都被時間沖淡，只剩「來個 Cellani」這句話傳遍龍域，會怎麼想？Islaen 說：「我想他會笑著說：『這樣就很好。』」","龍的傳承：整個龍域，幼龍都知道月花龍群，知道「來個 Cellani」的意思，也知道龍攜手就能完成不可能。他們知道真相、真名、真實掙扎與成就嗎？也許不知道。但 Islaen、Quaoar、Bryaan、Tiker、Cellani 出發時，並不是為了被記住，而是為了使龍域更好。透過故事，他們給無數幼龍希望，其中尤以 Cellani 為最：他教龍域知道，在同伴協助下，大膽行動可能帶來最好的結果。","我是歷史學者，盡力忠於事實、忠於發生過的真相。但在這裡，我必須承認：他們的傳承，Cellani 的傳承，無論是否完全真實，都是整個龍域的恩惠。"],"bullets":[]
  }
  ,
  {
    "id":"ed-sky-city-story","title":"墜落的天空之城","en":"The Sky City That Fell","category":"expansion","kind":"譯文","source":{"book":"Encyclopedia Draconica","pages":"38–45","file":"encyclopedia"},"paragraphs":["Neela Mandadapu 著；Ajit George 譯錄。「噢，Saraverasa，那是個夢。神祇、君王與瘋子的夢。除了 Kalabhras，沒人認為能建成。它是全體龍族團結時所能成就之事的願景，超越血與鱗，足以媲美群月。當然，注定失敗。」——Jayesh Verma。","三位戴冠龍在 Nalankilli 之戰死去，其軍隊投降後，年輕龍君 Kalabhras 的王位穩固了。Valavan 王朝無人挑戰，統治整個 Dravidia（譯錄者註：如今稱為龍域大陸）。奉命慶祝一千次月落，這是黑暗尚未成形、大家族才剛浮現於先祖心頭、距戰爭尚有悠長歲月的年代。和平繁榮，前無古人、後無來者。據說舉國喜悅，唯有 Kalabhras 不然。","夜裡宮廷巨龍歡宴，年輕君主卻在城垛踱步。宮殿建於大陸最高峰，Kalabhras 滿懷不滿地眺望帝國。他是王朝第二十七任統治者，帝國卻由祖先創建，沒有任何東西出自自己。舉國慶賀的每一天，幼龍都在悲傷，思索命運、如何被後世記住。若未在土地、龍史留下印記，龍不可能真正成為遠古龍或神祕龍。自己將是血脈中最微不足道者。想尋找可稱為自己成果的事物，念頭卻使他陷入陰暗憂鬱。臣民歡慶帝國終獲和平，他卻哭泣。","直到慶祝期最後一天，Kalabhras 仰望星辰與群月，那些註定其偉大統治的天體。望著莊嚴光輝，他忽然明白帝國尚未觸及一處：天空。翌日，他命 Dravidia 的龍建造世界前所未見的偉大城市：Saraverasa。","Kalabhras 要建城崇敬天空，並需要 Arjun 實現它。Arjun 是 Dravidia 最頂尖的工匠，一隻聲望如傳說的長牙龍，構想、設計、創作了許多聞名全國的藝術品。年輕君主如今命他領導新都工程。Kalabhras 要真正的藝術家，勝過單純建築師，要建成全龍族的榮耀。願景打動 Arjun，他立志創造永恆之物；Saraverasa 將集畢生事業之大成，成為無可比擬的成就。他自豪接下任務，為可能的創造、君主正在建立的事物，以及它對龍族的意義而自豪。","兩者花大量時間琢磨每個細節。雖各懷渴望，仍找到共同興趣與目標；合作很快將結出更豐美的果。城的地基由一整塊黑曜石雕成，大小足有一萬隻長老龍。大師們以爪、牙、槌，雕出紀念古君、英雄、慘烈戰役及群月諸神化身的巨碑。基座橫幅刻著假長老 Pandu 被敬愛的最高 Septack Naruala 可恥擊敗；巨大浮雕描繪老鬚龍 Pathinama 與十二株金銀樹誕生；精準刻畫至今傳唱的史詩《Vhyasthra Satnama》，以悲劇愛情引發堂皇王冠王朝之戰的場景賦予詩歌生命。","地基完成，最偉大、睿智的龍將魔法注入其內。每隻都放入一枚吸收千夜月光的心鱗——龍最珍貴的鱗片！——然後城市升空。全龍族驚嘆，對 Kalabhras 卻只是偉都的開端。","Arjun 建議在中央建神殿，敬奉孕育龍族的五輪月：Patha，岩石；Ahandee，風暴；Shuny，虛空；Atmha，靈魂；Svata，自由。那將是新都最偉大的建築。Kalabhras 聽從，因為不僅信任大師，也愛上了 Arjun，而年輕統治者的愛亦獲回應。他們對彼此、對城市的熱情不減，期望迎來藝術、魔法、和平的持久新時代。五座尖塔仿照五位手足形貌，交纏升天，神殿化為壯麗殿宇；城市由此向外旋展，每座新建築都增添榮耀。","Kalabhras 的右爪 Aadita 看著這一切成長成功，對君主狂妄妄想懷抱烈火般憎恨。Aadita 是鬚龍，從君主出生就任首席大臣，亦忠實侍奉其父 Dhairya。帝國的榮耀力量大多出自 Dhairya。如今自己在幼君身邊的位置卻被取代。愛情不重要，情人要幾個都行，但誰都不該比自己更優先成為顧問！自己才是帝國輝煌真正的設計者，卻被區區工匠推到一旁。絕不能容忍。","Aadita 在耳邊播下疑慮與不和：城市中央該是宮殿，而非神殿吧？所有人難道不想看 Valavan 的威力與榮耀？那不該鼓舞國家，使眾人在統治者前顫抖？治國的不是群月，是偉大的 Kalabhras！Arjun 為何把神殿放中央？","疑問折磨幼嫩、脆弱的心。Kalabhras 最渴望的，就是擁有自己的光明位置。祖先從默默無聞中崛起，聯合分散部族，建起帝國。甚至三位反叛戴冠龍的敗亡，也是 Dhairya 的勝利；自己只在勝局已定的最後時刻登位。Saraverasa 是自己的，為何讓給別人？為何讓五輪月居於家族、自身之上？","瘋狂攫住 Kalabhras。他下令砸毀神殿，碎片散布全國。君主對龍族而言與任何月亮同樣重要，為何群月優先？神殿遺址要立起龍族前所未有的奢華宮殿，中央依 Aadita 建議，建一座令全城雕像相形失色的金像，確保自己的至高地位與永世傳承。Arjun 驚訝、痛心，兩位愛人為此爭吵，Kalabhras 卻不受勸。Aadita 謊言的誤導，加上統治者渴望被記住的傲慢，促使新計畫繼續。曾敬奉群月智慧神性的神殿，如今變成奉獻給君主自我的宮殿。","Aadita 重獲信任，持續提出改善城市的建議，每項都削弱 Arjun 的藝術與願景，使大師愈發苦澀。城市完成時，最後一擊來了。Kalabhras 準備遷都，自豪欣賞成果；Aadita 卻另有打算。他私下說，雖然愛新都的美與壯麗，可惜飛得太低，低到普通龍都可抵達。怎能稱得上真正首都，除非佔據應有的天界位置？為何天空榮耀只屬五輪月？Kalabhras 難道不是君王，不配按統治全國的身分受到敬拜？也許，能成為第六輪月？","年輕 Kalabhras 深受打動，欣喜想像 Saraverasa 升到萬物之上、與群月平起平坐。最偉大的龍族創造將由自己統治，也許永遠統治！不朽甚至神性，都將屬於自己。但怎麼做到？Aadita 回答：靠龍，靠龍之力。","Aadita 展開前所未見、邪惡可怕的計畫。為了創造和平，君主擊敗多少敵人？那些人被征服，如今卻和其他人一樣享受王國舒適，憑什麼不為皇帝效勞？利用他們，命他們扛著城市上天、前往群月，讓君主取得應有位置。","計畫成形。Arjun 不信又驚恐地看著 Kalabhras 下令，把每一隻曾對王朝揚牙伸爪的成年龍鎖來首都，數百隻綁在城市外緣，被迫飛翔，飛到最遠、飛得比任何龍曾到之處更高。痛呼無人聽，苦淚無人理；唯有城市與君主榮耀重要。","「更高！更高！更高！」Aadita 慫恿下，君主不停命令。Aadita 說，所有人都該看見榮耀，叛徒應把城市拉上天，位置不是群月之側，而在群月之上，因為 Kalabhras 真是全龍族最偉大君王。幼龍被怪物般飢渴攫住，鞭打奴隸。破碎、心碎的龍拉著、倒下，拉著、死去；每倒下一隻，就有另一隻被迫取代。他們飛得比魔法能抵達的更高，比龍應飛的更高。","城市升高，奴役者痛苦愈烈，五輪月悲憫、憤怒、哀傷地看著君主傲慢及其釋放的邪惡。終於，自由之月 Svata 擊斷鎖鏈，釋放所有奴隸。失去魔法的城市墜落，碎成百萬塊，燃燒流星般散遍大陸。受君主狂妄支配的王國，看著傲慢的紀念碑轟然崩落。","沒人知道 Kalabhras 與 Aadita 的結局。有人相信最後時刻君主醒悟，兩者互相撕咬著跌入海；也有人說君主到最後仍瘋狂渴望權力榮耀，只顧望月，Aadita 則一直笑到最後。","據說 Arjun 隱退山中最深洞穴，每天作一首詩讚美 Saraverasa 原可擁有的美，每夜在月光下焚燒。龍們為紀念他，會在他的生日為敬愛的亡者寫詩焚燒。至於天空之城遺跡，傳說受詛咒，發現便應依儀式燒毀。然而群月確實祝福過 Kalabhras 的善工；祂們的倒影，仍在破碎神殿成簇的黑曜石中閃耀。"],"bullets":[]
  }
]
