[
  {
    "id": "ed-far-reaches-story",
    "title": "遠境要塞之旅",
    "en": "Quest for the Far Reaches Stronghold",
    "category": "expansion",
    "kind": "譯文",
    "source": {
      "book": "Encyclopedia Draconica",
      "pages": "62–69",
      "file": "encyclopedia"
    },
    "paragraphs": [
      "Kebros 的 Tres 著；Emily Care Boss 譯錄。「沙化作玻璃高塔，我們的靈魂亦在真實世界知識的磨洗中改變。但如玻璃可能有瑕，一旦恐懼的暗影滲入求知，靈魂也會碎裂。」——Myndoth 的 Mendarra，暗影戰爭爆發前二十五年。",
      "很久以前，暗影戰爭之前，橡木家族的風語者 Mendarra 在遠境沙漠邊緣建立圖書館。他是我的先祖，也是那一代最有前途的學者。他的消失對家族，如圖書館的消失對整個學派，都是重大打擊。橡木家族喜歡秘密。知識與美兩團火吸引睿智、機巧者前往遠境，尋找南方土地的智慧祕密。有人說，Mendarra 發現即將到來的暗影，曾與戰爭的一位先驅交戰，打碎收藏舊世界秘密的鈷藍塔。",
      "他最初獨自在沙漠工作，在基岩鑿隧道，後來成為閃耀高堡的地基、地下層。他呼喚風暴之月，以力量從活岩鑿出深溝。接著遊遍各角落，從龍族大集會與詠月聚會帶回典籍、故事、歌，什麼都收。他與自認握有世界奧祕鑰匙者交談：群月寂靜中保存的古物、地下生命的曲折、龍心經歷世代交易研究與藝術探索的精煉。有時找到精細工藝，內藏不能閱讀、卻低語著他人可能學會其道的祕密。",
      "據說他彙集自大分裂到戰爭前夕所有已知先知的異象，編成法典。他的傳承證明偉大，但法典之說令我難信。真有可能？那書的力量……",
      "受追求鼓舞，許多人前來。數十位橡木家族成員定居，另有 Semscale、Rothscar。最偉大者是黃金家族的織造者 Klynyth。按當時傳統，他出生即被選中訓練熔鑄塑造青銅鋼鐵，在首都成為大師。到遠境後，他把鍛爐之火用來學習熔沙，化成閃爍黃金、燦爛紫晶。",
      "他的到來永遠改變圖書館。他把沙織成多彩玻璃塔，收藏 Mendarra 的卷軸泥板。在他及大群 Rothscar 學徒、熟匠努力下，高塔升起。我們不知道如何造出描述中的厚牆：轉角有一龍身長厚，與基岩相連。他們從遠方開採運入貴金屬，恣意織入多彩光澤。玻璃聚光，創造優雅空間，學者終能認真編目研究。自地下黑暗嶙峋空間，他們走入寶石色尖塔。",
      "紫晶塔據說招待賓客，房間奢華，棲架通風，寬敞到能長談入夜。琥珀塔屬熟匠與學徒，長時製作搜尋；隧道高塔建得多快，祕密就填得多快。翠綠塔是 Mendarra 領域，藏其珍寶，只有少數可信或有勢力者能進。鈷藍塔則是 Klynyth 傑作，展示龍族漫長歷史、神祕沉思、艱辛成果；Rothscar 的繁複奇器在沙漠孤風吹拂下滴答嗡鳴。",
      "據說 Brythmalleck 在首都管理的大圖書館呼應遠境，堆滿卷軸、刻板及厚重皮紙精裝大冊。巨大琥珀玻璃窗由 Klynyth 倖存學徒吹製。高聳穹頂令人想起鈷藍塔，雖然開鑿館舍的深灰玄武岩，既不同於要塞巧克力紅基岩，也不同於旋紋多彩玻璃牆。",
      "Mendarra 是我的高高高高祖。我繼承一些著作，捐給 Brythmalleck 時，他難得懂得感激。他專攻古語翻譯，曾花一年研究「火爪文」——我們能懂最古老語言——的一份文本。筆記顯示，他相信其中教導海洋彼岸的祕密。我已讀過他研究的全文，此後也發現數片殘文；恐怕他走錯路。那其實是航海，詳細說明如何依星飛行或游泳，沒有深祕，只是地方知識。卻是那麼久以前的地方知識！如今視為了解祖先日常生活最寶貴的文獻之一。但他總找最異國的祕密，我不確定這些能讓他快樂。",
      "失落前，遠境與其他圖書館交換資訊。首都有一座當時王室所屬的館，專藏神聖詔令、歷史、族譜。暗影戰爭的疤火毀掉港口與東丘，此館及許多文本失落，幸而族譜副本散布全大陸，幾乎沒有完全失傳。",
      "其他龍加入後，研究形式蓬勃。從滿塵學問與萬種雜藏，來者開始向穿越沙漠的能量流敞開。翡翠家族 Hamundil 說，有時夢見祖先攀登者 Irvati，像倒溯記憶。Irvati 以攀高山、汲靈魂之月創造能量聞名。同時代的人不解他為何加入遠境，但他聽見高地沙漠塵、沙、石的聲音，於是出發。",
      "琥珀塔翻譯室永遠滿座，比北方霧牆陰影中的高塔抄寫室、東港論壇都早。據說也有房間供物質、礦物實驗。地下最深、Mendarra 鑿出的室內，Klynyth 建實驗工坊，發現又失傳許多技法。有些令人不安的邊註說學徒性情改變；其中一位似乎被冷火灼傷？",
      "圖書館毀滅的記述令人心碎，但謎團之一，是沒有親歷者紀錄存世。只有沉默突然降下：Mendarra 慣常旅行停止，運金屬、天使木、大捆羊皮紙的工匠停來。少數當時在綠松石河運送重得不宜翼載貨物，或遠在山中者，回來後傳出要塞毀壞的消息：門破、頂倒、塔殘，偉大鈷藍主廳成瓦礫。有人說翠綠塔發生轉變，細節未留。",
      "倖存者幾次返回，搶救失落知識殘片，暗影戰爭爆發便停。後來連要塞位置也失傳。但曾在 Klynyth 工坊工作者，在工藝上作出極大突破，很快接受戰場考驗。首都第七塔的玫瑰窗紀念圖書館與逃過崩毀者。我一直著迷花瓣尖端的怪字。幾世紀解讀無果，最後被視為裝飾，未發現意義。",
      "近年的學術突破，都來自一個重大發現：Brythmalleck 圖書館珍藏的《遠境無名書》。橡木家族傑出學者 Weneth 在首都小巷撿到它：封面無字、裝訂破舊、毫不起眼，內有古代國土的圖表地圖，薄而透的紙畫著山、沼澤、彎曲海岸。",
      "Weneth 認出註記是戰前 Myndoth 抄寫員筆跡，因而知道有了發現。家族傳承尤其顯在母音捲筆；古時抄寫員進行無聲華麗之戰，較量誰能在最不起眼文本加最多美。我光在 Myndoth 學者就看過十七種「啊」音寫法，雖說該家族確是這種無聊消遣最有野心的參與者。",
      "Weneth 也認出 Klynyth 筆跡，因為正與 Rothscar 同伴 Bjorn 解讀其設計筆記。Bjorn 的熟匠作品，是重建大師離首都赴遠境前的一件器物：以青銅與骨交織、圓而中空的球。Weneth 翻遍書架書格找工坊紀錄，也找到私人筆記。",
      "《無名書》除了建造圖——或許終於解開厚玻璃磚牆為何、如何紡鍛——也有標明要塞位置的地圖。這樣大的要塞竟弄丟，似乎奇怪；但後來戰爭的損失掩蓋了它的崩毀，重新尋找的嘗試也都中斷。書中還有通向內部祕路的段落，古怪如謎、曲折繁複，不像緊急逃生用途。而當初何必設逃生？襲擊前土地和平，除劫掠、政治陰謀，當地最後一次海岸戰事早在二十年前結束。",
      "理論紛歧。Weneth 的另一位同伴、Tessith 的 Marshemay 認為只是為迷惑沙漠野生動物，例如岩上曬太陽的棘蜥、山腳的鹿豬。鋼鐵家族 Azadene、Shekar 認為也許後來才增建，源於暗影崛起的偏執。Bjorn 則認為建造者的創造力與古怪性情充滿整棟建築，所以附近岩丘會有螺旋通道向下，連接一系列房間；要滑動、轉動刻有古家族符號的石板，才能開門。目擊者說很像銀墓。",
      "我們就是不知道發生什麼。倖存者的記錄全無存留，為何後世卻說要塞被暗影攻陷？有人認為 Mendarra 探索時暴露於暗影，不知不覺帶回，由內毀滅。我的祖父母堅稱是先祖自招，父母否認。雖翡翠家族未收我，我曾夢見一場自信真實的異象：從 Mendarra 視角看，身上翠綠虎焰紋交替藍黑，獨特得龍族此後再無重現。我還年幼，記得四周尖叫、石頭崩塌，他緊抱一根紅寶石與骨製的杖。僅此而已。",
      "恭敬呈上。Kebros 的 Tres，Brythmalleck 圖書館抄寫員，遠境 Mendarra 的後裔。"
    ],
    "bullets": []
  },
  {
    "id": "ed-tessith-story",
    "title": "Tessith 家族與暗影戰爭",
    "en": "House Tessith and the War of Shadow",
    "category": "expansion",
    "kind": "譯文",
    "source": {
      "book": "Encyclopedia Draconica",
      "pages": "79–85",
      "file": "encyclopedia"
    },
    "paragraphs": [
      "選自學識大師 Davven 日記；Katie Lyle Elsinger 譯錄。「起初，每個家族都中了驕傲的迷魂歌。直到傷亡幾乎無法計算，我們才肯低下高傲頸項，承認沒有任何單一家族能打贏，但也許所有人一起足夠。那最後、最好、最絕望的希望，迫使我們領悟本該在戰爭第一刻就明白的事。」——Tessith 家族學識大師 Davven。",
      "我們還不知道自己在打仗，戰鬥已開始數週。黑暗一寸寸爬過地景，碰過的地方、東西，全留下污穢。草、花，甚至樹木泛黃萎蔫；鳥與小生物逃離逼近暗影。土地腐爛時，疑慮也播進驕傲龍心。",
      "小型蝸牛猿狀生物很快被叫作蝸猿，從死褐草地下鑽出。前臂不自然地長，笨重行進時拖在泥裡；背上寬殼如堅韌外骨骼，牙爪無法從上方傷害。但牠們小、不能飛，我們只需升空就能避開。較小幼龍面對面遇過，警告大家牠們狡猾，龍領主只是大笑。",
      "數週過去，黑暗帶來比死亡更糟的事。起初污染太輕，激不起恐懼，看似僅在表面，小規模交戰輕易擊退。每個家族都無知地以為，只要認真，隨時能毀滅它，只是時機總不對。直到那晨，Tessith 從 Adámas 要塞醒來，期待黎明，卻看見墨黑之牆壓來。",
      "偉大始祖 Adámas 是家族最早創建者之一。紀念其名的要塞建於天然溫泉上取暖，族人來產卵，最兇猛的戰士以守護這美麗建築為榮。當清晨值守的家主 Asteraceae 捎信其他家主，宣稱將與勇將 Atrox 及家族威武戰士，一舉終結這可悲的黑暗威脅。",
      "好奇與家族自豪被勾起，眾龍成群來看。Tessith 在要塞上空列陣，由 Asteraceae 及美麗白鱗 Atrox 領軍，模樣令人敬畏。皮翼拍打凝滯空氣，攪起下方硫磺腐敗氣味；各色各體型的龍自信喧昂地盤旋，準備展現力量勇氣。鑽尖高塔上白旗飄揚，俐落線條與模糊黑暗對比鮮明。",
      "Asteraceae 展開巨大的緋紅翼，飛在軍前，發出勇敢咆哮。眾聲齊起，美麗致命，共同藐視恐懼疑慮。他示意 Atrox 等候，轉向暗影，想第一個正面迎敵。黑牆不停逼近，黑得近乎實體。他再次怒吼，黑牆終於碰上，我們全都學到真正恐怖的意義。",
      "薄煙般觸鬚從黑暗伸出，陰險指頭纏住四肢、翼、長頸。他顫抖掙動，好像接觸處都燒起來；暗影如飢蟲群爬滿身體，沉入曾閃紅寶石光澤的每片鱗間，留下死暗的陳血色。有一刻似將整隻吞沒，但消失前，他慢慢轉回驚愕的親族陣列。",
      "我們眼看眼底活潑火焰熄滅，變成冷灰無生氣的顏色。空氣靜止幾個漫長瞬間，像在屏息等候。然後前領袖口中爆出刺耳巨響與苦綠火舌，打破寂靜。英雄的心已轉邪，事情就是這麼簡單：我們可能被殺，更可能被污染，反過來攻擊一生所愛所知的人。",
      "綠火擊中外塔，尖塔崩塌。沒人看見牆裂，沒人知道看似弱小的蝸猿，早已花數週掘地、破壞根基。龍、幼龍，整群剛產下的蛋，都壓在大理石塔下。眾人驚呼，Atrox 卻轉身，向那曾是家主、如今是敵人的東西雷鳴般挑戰。",
      "Asteraceae 不顧一切、毫無辨認地衝來。更精於戰鬥的 Atrox 輕蔑冷笑，迎擊最親的同族，猛烈碰撞炸出衝擊波。手足在空中翻滾搏鬥，撞建築，使已脆弱的石頭墜落。Atrox 傲笑漸失，明白家主、自己的龍群同伴真的不在了，留下之物擁有不自然力量與單一目的。",
      "驕傲在將軍臉上動搖，一絲恐懼閃過。那一秒軟弱中，Asteraceae 抽回長頸，黑牙咬進裸露咽喉，甩頭，將將軍拋進學識之塔的裂石碎玻璃。塔向內塌，岩塊亮塵掩埋 Atrox。戰龍看著最強者的生命之血浸土，畏懼退後。",
      "在這充滿恐怖失落的時刻，三個小藍身影穿過空中陣列，面向 Asteraceae。這是同窩 Tessith 幼龍 Hyacin、Kyaneos、Gormuaine，才剛夠年齡獲分派守衛。未經大戰，體型只有前領袖一小部分，臉上卻是決心，不是傲慢。他們如藍寶石飛鏢衝去，四者在灰暗空氣裡翻滾。三者化為牙爪旋風，奮力對抗長者，莫名勇氣感染周遭。更多腐化龍及黑暗畸物從要塞上空暗影出現，衝突擴大。",
      "很快，美麗強大的鑽石家族，每一支血脈的戰士都參戰，親族驚恐觀望。黑暗似乎更容易滲入獨行者，扭曲思想，使之反抗親族，身體只剩無魂、無獨立思考的工具；與盟友並肩者，則更能擋住邪惡。新敵從自己隊伍內部襲來，混亂爆發。最強戰士迎擊失落朋友，幼龍對抗陰影中孳生的巨型昆蟲變種。",
      "混亂中，三手足在地面、空中持續對抗墮落領袖。Asteraceae 似乎不知疼痛，怎麼說理都無用，即使他們拼命呼喚其本我。藍龍配合：兩隻分心，第三隻利爪撕翼，不給腐化者單一目標，反制其專一攻擊。有時爪牽爪螺旋衝入，噴火打穿甲鱗。",
      "終於雷吼一聲，龐大 Asteraceae 墜地，揚起巨塵。生前那隻龍的一小部分，短暫重現眼底，直接對倖存戰龍說話：別怕接下來的事，收下這份禮物，聯合其他家族對抗黑暗。最後勇敢犧牲，他向自身噴出龍火，身體崩成灰，片刻後只留巨鑽，那曾是活心的 Asteraceae 之心。鑽石裂成小片，發出希望的暖光。",
      "心光中，黑暗似乎退潮，不再有怪物出現。Tessith 殘部迎來戒慎平靜，暗影也退後少許。我們如今稱為藍寶石手足的三位英雄，站在家族廢墟。幾乎所有戰士已死或殘，曾美麗的許多建築，燒著敵人地獄般的綠火。",
      "手足拾起碎心，飛送其他大家族領袖戰士。碎片帶來謙遜祝福，使人能從外在視角看待自身，也能阻止黑暗壓倒戰士心智。戰後多年，年輕龍遠行前會先朝聖此心。",
      "第一日戰爭後，大多 Tessith 退入其餘要塞，尋求失去戰士後不再擁有的保護。但三位藍英雄不被如此慘痛損失嚇退，並未埋頭，反而攜碎心起身，成為其餘家族聯合對抗殘敵的首批倡議者。這回沒有龍領主敢再嘲笑警告。",
      "可惜這只是漫長鬥爭第一天，不久家家感到黑暗威脅。無數地空戰，對抗腐化戰士、暗影憎物，以及敲打內心的悲傷。若未從 Tessith 敗亡學會準備、與鄰人合作的價值，我們恐怕全將同此命運。從那天起，敵人再小，一見就鳴戰號，任何家族都不再孤軍作戰。",
      "戰後較平靜年代，生活恢復近乎正常，碎心卻從收藏要塞消失。無人知道下落，只有傳說低語：苦難之時，碎片將被找回重聚，將平衡帶回龍域。"
    ],
    "bullets": []
  }
]
