[
  {
    "id": "ed-monastery-story",
    "title": "松龍武修道院",
    "en": "Son-Longwu Monastery of Martial Arts",
    "category": "expansion",
    "kind": "譯文",
    "source": {
      "book": "Encyclopedia Draconica",
      "pages": "14–21",
      "file": "encyclopedia"
    },
    "paragraphs": [
      "龍域歷史文化學院的龍族學者、探險者 Longcloud 著；Brendan Conway 代表 Lin Liren 譯錄。「當心完美葉片底下潛伏的陰影。」——《Wulong 格言》。",
      "我從未去過像松龍武修道院的地方。在那裡住滿一年之後，也再沒遇見相似之地。它藏在山中，四周盡是白雪與寒冰，頭頂藍天，雲近得不必起飛便可碰觸。寒冷如利爪切穿鱗片，但過一陣子，你會學著愛上它，愛它使一切變得更銳利、清晰、乾淨。起初稀薄空氣令人難以呼吸，不久你就會大口飲下大氣，每次吸氣都聞到雪。",
      "修道院從雪棘山脈的一座山峰內開鑿而成。四周群山遮掩它，使山脈之外的幼龍看不見；海拔又高得沒有龍能從上方發現。任何一部分都未超出山原本的輪廓。所以你要嘛原本就知道它在哪裡，要嘛橫越山脈時極幸運地誤闖。Wulong 教導：幸運者並非幸運，而是受到群月引領。但我說得太快，先談起教義了。",
      "松龍武是心智的避難所、身體的熔爐、靈魂的家。名稱中的武術由外人後來加上。沒錯，它傳授龍域其他地方看不到的戰鬥之道，但在許多方面，武技其實是教誨中最不重要的一部分。我最初前去，是想親自學武，不是想打架，而是希望拓展自己的界限。我以為修道院能提供的只有武技，完全不了解等待我的事。",
      "Wulong 的故事：你可能聽過各種面貌的 Wulong——鳥兔幼龍、風語者、滑鱗銀爪，等等。歷史學家追溯根源後，發現這些故事都與 Wulong 相連。故事遠早於暗影戰爭。古時 Wulong 旅行龍域，親身體驗以認識世界，同時解決問題、矯正不義。這些寓言說明龍族維護善意、仁慈與美德的重要。如今大多被當作雛龍故事，仍有歷史價值。我朋友、史學編纂者 Annaka Wishtail 認為，現代龍群為議會出任務的制度，部分可能來自 Wulong 的事蹟。",
      "若你不熟悉，以下便是要點：年輕 Wulong 聰明、狡黠、機巧，心地良善，盡力幫助所有人，也相當淘氣。有時以懲罰或殘酷的小把戲教訓別人。長大後，則更睿智、平靜。使用 Wulong 這個名字的故事，通常分成「年輕的 Wulong」與「睿智的 Wulong」。後者和平、開明、仁慈，不玩把戲，也不施殘酷懲罰；只有理解、同情，以及仍然靈巧的智慧，使其從〈兩隻鼠鼬〉到〈無盡繁花〉，都能解決任何問題。",
      "這位受尊敬、象徵智慧、指引與善的角色，其故事與真實幾乎肯定只有微薄關係。松龍武是其影響與教誨最實在的證據，因此是龍域珍寶中格外耀眼的一顆。",
      "松龍武的教誨：Wulong 的教誨體現在格言之中。「收爪斂翼，方能察世。」「夢群月與繁星夜，讓心眼安歇。」「愛友亦愛敵，力量偉大永滋長。」確切說，共有三千七百八十四則；韻律、押韻隨翻譯而異。完整理解其深意，被視為一生甚至更久的工作。我只能提供最簡短的概述。",
      "教誨使幼龍相信，龍域所有生命相互連結。野獸與龍、怪物與雛龍、月亮與暗影，全都相連，只有認知失敗、無法看見存在的真相，才使它們顯得分裂。由此可知，幫助任何人或事物，就是幫助一切存在的合一。因此松龍武教導龍以任何能力，幫助所有有需要者。",
      "但學習循序漸進。離院進入世界助人的龍，起初尋找明顯不義與惡行加以制止。他們對幫助「合一」的理解，難免顯得粗糙，也映照 Wulong 自己的成長：從年輕到睿智，走遍大地、幫助萬物，發現真正理解與同理的價值。最終旅程會將他們帶回松龍武，完成試煉，終於理解 Wulong 當年學到的真理。",
      "修道院生活與 Wulong Kai：松龍武是沉思、研讀、磨礪之地。新來的幼龍像長而疏於照料的鈍爪；修道院將他磨成利刃，不是為了製成武器，而是鋒利的爪能做的事遠多於鈍爪。Wulong 從不以暴力或危險為本性，卻也不忽視力量的必要。有些事無法接受，也無法靠言語與思考扭轉。Wulong 必須以切割使之成形，但永遠視作最後手段。",
      "龍們每天清早醒來，向日月冥想，接著花數小時做雜務、維護修道院，再次冥想，然後訓練武術 Wulong Kai——Wulong 之道。練習極度艱苦。每隻龍形態不同，所以大師會量身設計，把學生推到極限。長頸、柔軟的龍必須不彎身穿過石牆；滿身肌肉、強壯的龍必須從樹枝間疾奔，不擾動一片葉子。",
      "Wulong Kai 的核心，是推動每隻龍去做對自己不可能的事，讓他明白：若世上有任何地方做得到，他也做得到。畢竟萬物相連；完成不可能，只是借用相連世界另一部分的特質。這種意義與教誨很難傳達，因為太多涉及特殊心境，以及修道院環境帶來的改變。我所掌握的一點點 Wulong Kai，已多次救過自己。",
      "松龍武地底的黑暗秘密：現在終於談到真相，我留下紀錄的原因。我想保存松龍武的精髓，盡本分記下所學，確保檔案裡有一幅文字畫，讓後來者在我離世很久之後仍能找到修道院。但還有另一個原因：我必須記下一個謎，一個龍族需要保存的真相，以防某天它至關重要，以防它不只是一個謎。",
      "我在那裡時自然充滿好奇，想理解一切、看見一切，也確實投入學習。但我也去探索不該去的地方。一晚，我溜出房間，穿過暗黑修道院，尋找任何隱藏角落。我知道一定有學生不能看的區域，一定有文本、Wulong 的遺物，一定有更多。其他新生的傳聞指向下方，深入山體、修道院之下。他們說 Wulong 仍在這裡，已成為無比巨大、強大的神話巨龍，龐大的石化身軀支撐整座建築，字面意義上就是修道院的根基。",
      "當然，從歷史來看不可能如此：修道院建成時，Wulong 還不可能成為神話巨龍。但此類故事多半有些真實根據，所以我尋找山下深處的地基。我找到了：在最低層通道，以一點適當運用的月亮巧術開啟鎖門，我進入刻工精美的走廊。月光照見無盡文字，詳述 Wulong 的旅行故事，最後指向同學所說的景象：前方有一位安靜的神話巨龍 Wulong，支撐修道院，隨時準備在我們再需要指引時回應。",
      "幾乎無法克制興奮，我衝進修道院下方的黑暗，發現……什麼也沒有。Wulong 不在那裡。有一個龐大空間，大到最巨大的神話巨龍也住得下，而且有某物曾存在的跡象：原本必定掛在某個形體上的燈籠；倒下的柱子，也許曾用來支撐那形體，或由它支撐。但黑暗裡只有空無。",
      "這就是我必須記錄的真相。我不知道 Wulong 是否曾真正在那裡。無論如何，修道院仍持續傳授偉大教誨。但那片空白、那份缺席，以及它可能意味的事……我想，自己從未有任何發現如此動搖內心。發現後不久，我離開松龍武。我無法忍受修道院下那龐大空室的念頭，也害怕向長老提起，怕他們責備我夜遊，更怕他們早已知道空室的真相。",
      "我不知道接下來該怎麼辦。但若有幼龍讀到紀錄，後來抵達修道院……請找到那間房，查清神話巨龍是否仍然缺席。也請查明，我這些年始終害怕的事：那裡是否從來沒有真正空過……而是充滿了黑暗。"
    ],
    "bullets": []
  },
  {
    "id": "ed-yeraktos-story",
    "title": "Yeraktos：來自荒野的家族",
    "en": "House Yeraktos — The House from the Wild",
    "category": "expansion",
    "kind": "譯文",
    "source": {
      "book": "Encyclopedia Draconica",
      "pages": "22–28",
      "file": "encyclopedia"
    },
    "paragraphs": [
      "龍域檔案館遠征歷史學家 Slateclaw Empyreal 著；Brendan Conway 代表 Draco 譯錄。「有時，惡行唯一的贖罪方式就是時間。」——Yeraktos 家族導師，姓名保密。",
      "附註：以下文字原因內容不當，應予焚毀，並自檔案館紀錄中刪除。但我無法狠心摧毀這份知識。我已將它藏在檔案館中，希望若干年後有人發現，那時龍域也許已準備好閱讀其中真相。願我的越矩得到寬恕。——龍域檔案館副檔案員 Quillow。",
      "我們龍族回顧歷史時，也塑造歷史。我們改變故事、調整真相，加入新的理解，有時也刪去事實，好讓自己免於面對錯誤、越矩或罪過。我們不願承認這類編修，但必須承認。若真想誠實面對自己，就得理解自己如何傾向刪掉那些令人不安、顯露自身不完美的歷史。這就是我多年前開始調查 Yeraktos 家族的原因。",
      "起初只有煙絲般的傳聞，最淡的線索、最淺的痕跡：一個名字、一件古物、一座久遭遺棄孵育所石牆上的奇異徽記，都是早已打碎的馬賽克殘片。但越找越多，我便決心將它們拼起，揭露這埋藏已久的真相。",
      "最初，我以為這是對龍域的重大貢獻。顯然有隻幼龍被黑暗腐化，抹去了我們歷史的一個關鍵。畢竟暗影戰爭如此可怕，時局如此混亂，甚至權力殿堂裡當然也會有腐化的龍。他們自然會奪走賦予龍域力量的真實感與歷史感。",
      "接著我揭開真正線索：從紀錄刪去 Yeraktos 的，並非一隻腐化的龍，而是多人策畫、直達議會的陰謀。這個家族是被努力與集體意志，從龍域的記憶中燒除的。這是我們對自己做的事。而現在，我要撤銷它。",
      "Yeraktos 的榮耀：我們都知道 Kebros 及其腐化。Kebros 曾墮落，但即使如此，最終仍獲准留在龍域境內，永遠是文明與慈悲最偉大的行動之一。其幼龍未被逐至邊界外。我們沒有遺忘其善惡事蹟，也沒有背棄其族人。我相信，這正是因為龍域已從對待 Yeraktos 的方式學到教訓。",
      "Yeraktos 確實是一個真實、完整、偉大的家族。透過深埋的紀錄、拼合的記述，以及我用最深層月亮魔法探視的占卜，我得知其規模有多宏大。依古老傳統，他們的孵育所藏在裂爪山脈深處，幼龍必須獨自踏上危險旅程，自山底走出、飛向天空，以證明力量。他們的建築則靠注入力量的月晶，懸浮於龍域大地之上。正如孵育所沉在地下，權力與榮耀之廳高懸空中，隨風在龍域上方輕輕飄移。",
      "Yeraktos 精通製作月晶，將群月本身的力量封存其中，驅動各式奇異巧器：沒有實體、全以凝固月光製成的車；輕彈爪尖便能伸長的月晶長槍；可在月光下舞動扭轉的魔法雕像。家族的成功有很大部分來自這項創新。雖將月晶分享至整個龍域，製造細節卻始終是嚴加看守的家族秘密。而這一切終將化為烏有。",
      "戰爭的代價：暗影戰爭來到龍域時，Yeraktos 在前線作戰。他們穿著輕如羽毛、硬如鑽石的月晶盔甲，對抗黑暗的巨大造物；組成強大陣形，飛向成群腐化飛鳥。他們堅定、無畏，守護其餘國土。",
      "我從最深檔案或久忘雲堡中找出的紀錄，指出他們戰鬥的兇猛程度，前所未有，後亦不見。是的，他們是龍域高貴的戰士，但也很危險。記述描述驕傲的 Yeraktos 合併月亮所賜的雷電吐息，擊碎整座山；也描述他們同時鼓動雙翼，以強風吹倒整座暗影堡壘。這些故事大概都受到神話距離與時間潤飾遮蔽，但總有真實核心。我相信，Yeraktos 成為龍域的軍人家族，個個戰士，能在力量與戰鬥上完成驚人壯舉……這也正是其敗亡之因。",
      "今天黑暗早已戰敗，我們很容易以抽象概念談論它。但如今寫的字，在當時都是我們難以理解的真實。黑暗並非供人戰鬥的敵人，而是腐化力量，人們相信其種子存在每隻龍胸中，Yeraktos 也不例外。不斷與黑暗征戰，使種子生長、開花。他們逐漸被自己對抗的力量控制。原本的戰士變成怪物；摧毀欲與戰力成為詛咒。他們無法停止戰鬥。",
      "我在星爪迷宮燒毀的圖書館裡，找到一幅焦黑、埋在塵土瓦礫下的壁毯，描繪腐化 Yeraktos 的殘暴。足以毀山倒堡的力量不再受束縛，在龍域大地上任意撕抓。壁毯上，雲群般的 Yeraktos 幼龍帶著家族水晶徽記，降臨龍族家園，將它們燒成平地。那些在壁毯上清晰耀目的聚落名稱，也同樣被龍域紀錄刪除。",
      "他們仍與黑暗戰鬥，卻也成為與所對抗者同樣嚴重的災禍。很快，龍域守軍不得不同時對抗 Yeraktos 與黑暗腐化的怪物。我在裂翼山脈地底深處、遭棄置並封鎖的知識窖藏，找到最後幾場戰役的記錄。這些窖藏來自龍域害怕所有知識、甚至自身存在都將被黑暗毀滅的年代。因此，這些是盡可能可靠的史料，不是神話傳說，而是目擊者的故事。",
      "Yeraktos 一戰再戰。他們的神祕龍甦醒，從雲端降臨，雙翼傾瀉火焰，燒遍整個戰場。雖然傷亡慘重，他們的確協助扭轉戰局。怒瀑之戰、雲嘯之戰、鱗堡圍城，他們都在，協助擊退黑暗。不論公開史書怎麼說，Yeraktos 都是那些勝利的原因，也同時是那麼多龍域守護者殞命的原因。",
      "後來，記述漸稀。戰爭持續肆虐，還能在不參戰的情況下記錄事情的龍越來越少。因此結局只能由片段拼湊。看來 Yeraktos 一直戰到最後，如我們所知，黑暗終於被徹底逐退。勝利也使它離開族人的內心……羞愧隨之而來。他們為自己造成的死亡感到痛苦、悲慘，為遭黑暗深深侵蝕而內疚。他們明白犯下的錯，真心悔改，卻看不見希望或救贖，除了一條路：流亡。",
      "Yeraktos 全族離去，燒掉身後旗幟，幾乎不曾事先知會其他大家族，也未徵求許可或意見。接下來由大家族做完其餘事情，或出於憤怒、恐懼，甚至尊重其意願：刪掉紀錄中的家族，鑿毀石刻徽記，抹除一切提及、一切證據，而且用的是月亮魔法。",
      "我在月象館找到實驗性質的遠古儀式紀錄；吻合得太完美，不能忽略。這些儀式能讓許多成熟龍共同引導群月之力，大規模遮蔽記憶與知識。沒有明確證據證明曾用過，然而本來也就不會留下證據。",
      "我相信，大家族最偉大的成員聯手施行儀式，從龍域幼龍的記憶中遮去 Yeraktos，確保這個墮落、破碎、腐化的家族永遠被逐出龍域的故事。我只能想像他們為此悔恨羞愧……因此遇上 Kebros 類似的墮落、需要找出辦法時，選擇了另一條路。",
      "重新發現遺忘者：現在輪到我進入這個故事，不只蒐集事實，更要追尋它們。拼起真相後，我發現或許還能完整確認，甚至達成和解。Yeraktos 逃入龍域荒野，後代也許仍在；樹林深處迷失的某位遠古龍，或許能說出全部真相。因此我進入荒野深處，為龍域尋找 Yeraktos。",
      "我找到了。我不會說如何、在哪裡，也不會描述那是什麼模樣。不會說他們告訴我什麼，只能說他們仍深感內疚，仍為腐化羞愧，仍不確定自己是否配回到龍域。他們要求我保守地點秘密，我則主張是時候和解。於是他們同意確認我的發現，許我講述家族歷史，雖然不許我描述如今的族人。",
      "同胞們，他們就在外面，仍在龍域荒野裡。作為手足、親族、同胞，我們有責任找到他們，帶他們回家。願這份紀錄促使你動身，為了他們，也為了我們。"
    ],
    "bullets": []
  }
]
