[
  {
    "id":"ed-icons-story","title":"洞見聖柱","en":"Icons of Insight","category":"expansion","kind":"譯文","source":{"book":"Encyclopedia Draconica","pages":"102–107","file":"encyclopedia"},"paragraphs":["Cyncepitor ap Lleth 著；Cam Banks 譯錄。「我在灰禮山高峰找到第一座洞見聖柱。數週尋找、向長老懇求片段消息，終於領我到那裡。我為向他人索求太多感到羞愧，面對聖柱晶亮光芒在身後投出的自身暗影。只能說，彷彿暗影戰爭故事中穿透一切的光；離開便感失去。但如我多次所寫，那祝福仍由我攜帶。」——Myndoth 抄寫員 Cyncepitor ap Lleth。","洞見聖柱長久照亮龍域黑暗角落。巨大的粉紅石英柱，必須以朝聖尋得。與水晶調諧，可暫得一片啟悟或內心安寧。","朝聖：旅程可能數年。不靠地圖，求道者須向曾站在聖柱前者詢問，在心中彙集理解，才受引領起飛。聖柱與見過它的人有持久連結，比任何地圖好。長老相信，聖柱及神殿甚至偶爾遷移，或在全新地點自行生成，使一切導航圖徒勞。","朝聖並非沒有危險，聖柱從不在安全之地。神殿一旦找到，雖安靜平和，卻可能位於活火山底洞穴、克拉肯盤踞的深海溝、劇毒荊棘巨杉的強枝，或百年沙暴漂白鱗片的風中。多數獨行，也有人結群；若有陪伴，總有一位主要求道者，向友人分享聖柱拉力、說明方向、詢問問題。偶爾，尤其龍群之中，尋柱衝動與連結會同時出現在幾位身上，各有前路理解；只有全體合作、依靠友誼家族連結，才能找到。","守護者：數週、數月、甚至數年後，求道者抵達，找到神殿。記載說，首先必面對用來測試內心的守護者。牠們多肢、多眼、如蜘蛛，永遠警醒；大小依需要而變。歸來的 Egret Wingrake 告訴我，是一團細小晶光微塵，像剛孵的織網蛛。另有人說，是強大的審判工具。","守護者不是為了傷害朝聖者，而是阻止偶然誤闖，或出於惡意、不配目的者。動機似高貴，也難測；可能要求回答深刻哲學學術問題，或挑戰決鬥、鬥智。Iridis Yarrow-Reach 在學術著作寫道，守護者竟要求詩歌比賽，自己毫無準備，嚇壞了。","神殿：通過守護者，便進入鑲符文與寶石、石材旋紋的房間，反映聖柱柔光。柱直達天花板，是厚實無裝飾的粉紅石英。身在其前，所有衝動情感湧出。有些龍震驚，有些獲安撫，卻永遠深受觸動；靈魂全然赤裸。何等奇妙！朝聖、長途跋涉、對抗守護者之後，龍現在必須背向聖柱，面對暗影化身。聖柱使它成為身後真正的影子。","水晶先知：聖柱相關傳說神話最神祕的面向之一，是水晶先知。遠古的龍曾看護聖柱，或以某種方式負責將其送至龍域遠方。我導師、Kebros 長老 Theonex von Arrid 收藏的一片文獻說，曾有時聖柱全聚於龍域中央一間耀眼光室。那年代，水晶先知冥想、諮詢、調諧，將智慧恩惠賜給各家族最早創建者。Theonex 證稱，故事暗示家族衝突使先知憤怒，於是把聖柱送走。","其他賢者說，Theonex 用家族偏見解讀，或因羞於 Kebros 戰爭角色，或真信 Kebros 曾是最睿智家族。政治！少數賢者認為，水晶先知最多只是幻想；聖柱只是龍域與眾龍內在光明的集體顯現，將功勞歸給所謂先知，只是傲慢。","朝聖歸來者從不提見過或聽過水晶先知。不過，神祕看護者、聖柱神祕龍的後代，也許仍藏在各社群，向各家族播下文獻片段，溫柔引導強大長老協助幼龍，以自己的方式對抗黑暗。","重新聚合：世界究竟幾座聖柱，無人知。依來源不同，可能五，也可能八。一群勤勉英雄龍可能選擇的路，是不只尋找、調諧、享受好處，而試著勸說全部重聚，形成對抗將至黑暗的強大療癒力量。","這項稱為「重新聚合」的傳奇壯舉，是同僚 Theonex 學術研究核心。想知道更多，請找到據說為避批評者而離開龍族社會、獨自工作的他。修復他與部分學者破裂關係，甚至修復 Kebros 與其他家族關係，可能與朝聖同樣艱難；結果卻可能療癒整個龍域。"],"bullets":[]
  }
  ,
  {
    "id":"ed-festival-story","title":"月光節的歷史","en":"A History of the Moonbeam Festival","category":"expansion","kind":"譯文","source":{"book":"Encyclopedia Draconica","pages":"108–114","file":"encyclopedia"},"paragraphs":["Tessith 家族 Stutantalis 著；Eloy Lasanta 譯錄。「這是我們反思、慶祝、為彼此而活的時刻！」——Brynback 家族 Kimik。","龍域總有陰暗時刻，龍因疾病、事故或單純歲月失去同伴，為之哀悼。近九千個月亮週期前，富遠見的 Brynback 龍 Kimik，籌辦龍域有史以來最大的節慶之一，用三天慶祝身為龍的意義，及月光沐浴的世界真正可能擁有的模樣。如今月光節演變為五天，人人期待。最大慶典在 Yinsoth 山谷中央；其他城鎮也為無法遠來的居民，舉辦自己的版本。","第一日：岩石之傳。大門開啟，山谷華美，月亮魔法石把彩光束射入空中，更添光彩。棕旗標示遊戲、舔食點心的攤位，但最期待的是大賽。日頭最亮時，來自全龍域的數百隻龍聚到雕塑成形的場地，玩星球。Myndoth 鬚龍施儀式，把星辰本身之力召成一顆閃亮光球。玩法簡單：兩隊同齡龍輪流設法把球送過對方。難處是球太亮，拿太久會逐漸致盲，必須策略性傳、踢、用尾，偶爾甚至吞球才能贏。","星球賽延續入夜，直到選手精疲力竭、觀眾興奮得喊啞。短歇後，大家再聚頒獎；最佳球員獲贈閃爍虹彩鱗片裝飾自己。","第二日：風暴之怒。天空灰雲滿布，眾人期待節目。棕旗換黯灰，代表每隻龍為達潛能極致必克服的情感掙扎，讓人反思、解決一年面對的挑戰。當然，參與者仍滿臉笑容，奔跑嬉鬧，在風暴之怒庭院聚集，觀看年度競速。","選手從各角落來，盼贏年賽。目標先抵終點，但不容易：幾位長老在場邊製造龍捲風、雷電及各種可怕障礙，選手更獲鼓勵「不擇手段」，可撞人、召風把「敵人」吹偏。看似殘酷，卻是傳統，象徵龍曾彼此背叛的時代。不用這些手段獲勝者，則獎勵更多，強調善的勝利永遠更好。","過去十年冠軍全出 Kebros，其他家族很不滿；其中鬚龍 Tulelyte 已連勝四年。Kebros 陰招實在太多，使人難以全心認同勝利，但觀看時每個人仍樂在其中。翼失衡、敗者撞山，形成古怪卻引人的景象。勝者得鑲寶石的黑翼鱗，代表本年最快、最機巧的龍。","第三日：虛空之思。魔法使谷上天空轉黑，開始追憶之日。環谷峭壁刻滿暗影戰爭亡者姓名，永不遺忘。舉行發光翡翠守夜，英勇者後裔朗誦戰爭詩、故事、演說。幾隻龍單爪立高柱，動也不動，深沉冥想。下方眾龍重演戰爭決戰，一半扮警醒者 Nerroth、噬心者 Medolth 等英雄勇敢進軍，另一半合作操作大型暗影傀儡，代表黑暗軍勢。戰況激烈，通常由 Tessith 演說者逐擊、逐敗、逐勝向觀眾敘述。特殊光魔法、整桶整桶假血，讓演出更生動，眾人驚嘆。","最後黑暗被擊敗，操偶龍與造物全倒。天空首次轉藍黃，代表擊敗黑暗帶來的清明。當天以全節最大慶祝收尾，有所有人都能聽的音樂，有填滿年長龍喉嚨的蜜酒。一日情感完美並置，也是最多龍群一起參加的一天。觀眾還會為那些在下方混亂中始終站穩的冥想者鼓掌。","第四日：靈魂之新生。延續喧鬧慶祝，眾龍參加同名美食節，展示龍域富足；沉迷人生壞事時，很容易忘記這點。各地大廚帶新菜首演，分享招牌。Rothscar 的快手 Venia 固定供應烤香料綿羊蛞蝓皮；Semscale 的 Lycas 帶來熱門水果碎 Tapent 肉派。龍胃口出了名，所以這是全節人潮最多一天。","眾人享美食、吃遍各地珍饈，現場初鱗幼龍受邀參加攀藤賽。主辦者以月亮魔法讓巨莖直達雲端，幼龍競逐登頂。簡單比賽象徵龍域重新成長，象徵青年將引領眾人邁向沒有黑暗及其爪牙的未來。幾輪後，決賽選手對決，冠軍獲「最有希望的青年」。去年冠軍 Brynback 的 Neris，如今已成有翼幼龍，為龍群家族贏得榮耀。","攀登被說成幼年生命最陡、最高、最難的一次。途中長出雙翼相當常見，有些就改飛向頂端；成為有翼幼龍當然失去資格，但既然有翅膀，沒幾個還在乎勝負。","第五日：自由之合一。聚會演變為一波波美麗龍舞，各家族、各年齡一同慶祝自由於世間煩惱，也慶祝幸福真正依靠朋友龍群。當日節目有龍域最傑出音樂家、幻術師。最著名幻術〈十一月光籠〉，由 Semscale 的鏡影 Ixela 鎖在十一重籠裡，愈外愈大、鎖也愈繁複。他混合月亮魔法與老派誤導，不到十秒全脫，贏得驚嘆掌聲。","為表龍域團結，當日參加者帶禮物交換，送的不是親密朋友或龍群，而是從未見過、最好別家族的龍。有些送最討厭的敵人，也大受鼓勵，因能修橋、拉近社群。禮多親手做，花翡翠購買反而違背精神。","最後一日將盡，全龍域的龍，即使未參加正式慶典，都更快樂、日子更明亮。Brynback 長老登臺，愉快道別，提醒善待同族，祈禱黑暗永不回。眾人默哀片刻，散去。節後至少幾天，回憶好時光仍響在心中，大家能守這承諾。當然，龍性很快佔上風，許多迅速回到不那麼利他的行為。也有人全年保有節慶精神，那正是所有人該追求的。"],"bullets":[]
  }
]
