[
  {
    "id": "ed-kraken-story",
    "title": "克拉肯",
    "en": "The Kraken",
    "category": "expansion",
    "kind": "譯文",
    "source": {
      "book": "Encyclopedia Draconica",
      "pages": "131–136",
      "file": "encyclopedia"
    },
    "paragraphs": [
      "Icetooth Reinforth III 著；Mark Diaz Truman 譯錄。「牠們等待，在黑暗，在深處，遠離探問的龍眼。在火、空氣、生命之外的國土。為死去久遠的神築殿，等自己的時刻。」——克拉肯。",
      "克拉肯浮上海面，必因某物愚蠢得引起注意。幼龍試橫越大海，等看見來者總太遲：扭動黑觸手與利喙，連最大龍都從空中抓下。就所知，沒有東西逃過其怒。其實我們仍知甚少，只是水棲怪物，還是能創文化？牠們住在龍域環海，寒風波浪下如何度日，大都是謎。牠們是噩夢化作肉、骨、爪、觸手，我們卻不懂動機慾望。",
      "先知說，也許正建某物，拖石與冰過海床，為龍族之前的神造神殿。並非一直如此，如今卻移動、聯合、行動，有某種目的，超出理解。該擔心嗎？無龍知道。但我研究多個週期，能告訴你：牠們對龍族的憎恨，怒火超越歲月。若能一揮觸手摧毀全龍域，我相信牠們會。",
      "深海怪物：最早龍領主以為只是神話。預言者先知說海底有威脅，卻講不出本質，只知黑暗本身似遮蔽海岸外之物。數世紀後，領主想把議會勢力擴至龍域以外，才明白深處恐怖：多牙怪物，確保龍域孤立。",
      "如今初鱗幼龍都知危險，雛龍出生最初幾個週期，就被教別離岸飛過幾下拍翼。再遠便是引誘克拉肯，如火吸飛蛾，乞求尖叫的黑暗團——無法戰鬥阻止的牙、觸手、爪——整口吞下。最初幾次遠征的慘劇教訓後，我們才多了機會了解牠們。知道與黑暗相連，黑暗有時透其說話；與其是物種，更像怪物的集合。沒有典型克拉肯：除了觸手與黑暗連結，每隻都獨特。",
      "最大威脅一直是執意阻止龍離島，但議會先知有理由相信更險惡之物正浮上。黑夢顯示牠們水下移石、沙、冰，服務神祕計畫。不知文化或儀式需求，卻明顯遠比我們以為的更複雜。",
      "結下的仇：真相早已失於群月，是現存任何遠古龍孵化前的故事，也許永不知道。然而我與同僚研究議會崛起之前的文本，取得揭示。首先，關係並非始終敵對。最早文本雖稱威脅，卻用一古字，同時意指危險與潛力充盈。同僚 Ehterfell Zax 更找到早期插圖，畫龍向牠們奉獻、互獲禮物！",
      "無人確知夥伴關係如何開始，龍為何求其禮物，但文本提，全部安排在「大分裂」終止。某事使全龍背棄克拉肯，突變令牠們驚訝。所有文本一致：是我們先放棄協議，明知會使牠們永世為敵。",
      "最優秀學生之一 Stull Rightfinder 認為，古龍最初視之平等，發現對方陰險惡毒、與黑暗同盟才轉身。其他學生信更微妙：實際貿易同盟被地理時間削弱，被政治翻轉壓垮，僅此而已。我多想與早龍說幾分鐘！我們曾交易，卻全崩，為何、如何？最終必須在沒有克拉肯協助下回答。",
      "克拉肯之眼：偶爾死者沖岸。遺體見陽光、新鮮空氣很快融掉，卻留下一些……東西，光點斑駁的暗球，向龍呼喚、許諾。每顆巨大，體積約長牙龍，重量超出預期許多倍。低語起初微弱，龍獨處便漸高。受影響者少記得要他們做什麼，卻全說巨眼想交換，依古龍與克拉肯交易的方式議價。",
      "官方政策是當局回收摧毀。顯然危險，初鱗幼龍也知道別聽最大敵人的暗語。卻仍在呢喃，說古龍失於波浪的遠古知識。我自己聽過，驚於理由多迷人、多有說服力，讓人想聽更多！",
      "首都暗處卻有人低語：沒銷毀，議會把它們帶去大圖書館特別房間，由不計代價、想懂秘密的學者研究。但只是傳聞。議會肯定不會設這種地方，除非有好理由、許多許多預防。肯定不會愚蠢到讓幾十件危險古物，離自己開會廳只一段飛程。若真有，肯定會請我這位克拉肯學知名專家看。",
      "克拉肯學會：無論議會對巨眼做或沒做什麼，預言警告並未全遭忽略。許多人擔心，我們太少理解觸手敵人就在摯愛家園旁、海下籌謀。先知憂慮近期活動，有龍公開質問為何知這麼少。於是議會命設學會，由尋覓者、神祕學者、學者組成，負責理解及對抗可能威脅。我是尚未到年齡終點的頂尖克拉肯學者之一，親督成立，很高興報告組織生氣勃勃。成員數十，遍龍域，各解不同謎塊。",
      "想加入者須先奉獻一份克拉肯知識，證明價值。有些找來、控制一顆眼；有些從議會檔案尋回早失的互動記述。不論如何，須獻有價值之物，才獲認真接納。我們不需要只會追克拉肯的人，要已找到實質成果者。",
      "學會盼共同面對新威脅，準備處理觸手敵人從深處召的任何暗物，阻止儀式與入侵。研究挑戰真實：不能在自然棲地觀察，很難多懂。但我與全學會決意為龍域盡自己一分力！"
    ],
    "bullets": []
  },
  {
    "id": "ed-credits",
    "title": "《龍族百科》第一卷：傳說與故事——製作名錄",
    "en": "The Epyllion Companion Volume I: Tales & Stories — Credits",
    "category": "expansion",
    "kind": "譯文",
    "source": {
      "book": "Encyclopedia Draconica",
      "pages": "PDF 2–4（卷首與製作名錄）",
      "file": "encyclopedia"
    },
    "paragraphs": [
      "Epyllion 伴讀，第一卷：傳說與故事。出版：Magpie Games。印製：Lightning Source。首席開發：Marissa Kelly。專案經理：Mark Diaz Truman。開發編輯：Brendan Conway、Sarah Richardson、Mark Diaz Truman。文字編輯：Laura Waldhier。校對：Shelley Harlan。美術指導：Marissa Kelly。插畫：Jason Poole。平面設計與排版：Miguel Ángel Espinoza。原始平面設計：Kaylee Goyer、Sarah Richardson。封面排版與設計：Miguel Ángel Espinoza。",
      "Apocalypse Engine 承 Vincent Baker 與 Lumpley Games（lumpley.com）允許使用。",
      "作者作品：Marissa Kelly——〈賢者巨樹之心〉。Brendan Conway——〈松龍武修道院〉、〈Yeraktos：來自荒野的家族〉、〈「來個 Cellani」：月花龍群的故事〉、〈星辰之鏡〉、〈龍域家族的年齡與榮譽儀式〉。Ajit George——〈墜落的天空之城〉。Whitney Beltrán——〈幽蝕〉。Emily Care Boss——〈遠境要塞之旅〉。Kate Lytle Elsinger——〈Tessith 家族與暗影戰爭〉。John Wick——〈Kebros 家族〉。Michelle Lyons-McFarland——〈傳說與學識〉。Cam Banks——〈洞見聖柱〉。Eloy Lasanta——〈月光節的歷史〉。Jonathan Perrine——〈尋源者〉。Jason Morningstar——〈Fostr 柔爪的艱難試煉〉。Mark Diaz Truman——〈克拉肯〉。André La Roche——〈元素使〉。Eddy Webb——〈使節〉。Sarah Richardson——〈孤龍〉。Adam Koebel——〈反叛者〉。",
      "原書目錄：導言 4；龍族百科 5；賢者巨樹之心 6；松龍武修道院 14；Yeraktos 家族 22；「來個 Cellani」30；墜落的天空之城 38；幽蝕 46；星辰之鏡 54；遠境要塞之旅 62；龍域家族的年齡與榮譽儀式 71；Tessith 家族與暗影戰爭 79；Kebros 家族 86；傳說與學識 95；洞見聖柱 102；月光節的歷史 108；尋源者 115；Fostr 柔爪的艱難試煉 122；克拉肯 131；鱗片之下 139；元素使 140；使節 141；孤龍 142；反叛者 143；附錄：扮演書能力 152。"
    ],
    "bullets": []
  },
  {
    "id": "ed-rites-epigraph",
    "title": "龍域家族的年齡與榮譽儀式：卷首",
    "en": "Rites of Age and Honor in Dragonian Houses — Epigraph",
    "category": "expansion",
    "kind": "譯文",
    "source": {
      "book": "Encyclopedia Draconica",
      "pages": "71",
      "file": "encyclopedia"
    },
    "paragraphs": [
      "遊龍 Soartail 的研究；Brendan Conway 譯錄。「每隻龍都應留心，使智慧與體型一同成長；龍域所需並非愚鈍巨獸，而是博學龍族敏銳的洞見。」——遊龍 Soartail。"
    ],
    "bullets": []
  }
]
