[
  {
    "id":"ed-umbra-story","title":"幽蝕","en":"The Umbra","category":"expansion","kind":"譯文","source":{"book":"Encyclopedia Draconica","pages":"46–53","file":"encyclopedia"},"paragraphs":["Kebros 家族的紅眼 Nimra 記述；Whitney Beltrán 譯錄。「當心水慢慢煮沸。」——Kuru Blackclaw。","第一次幽蝕，發生於記憶不可及的年代，遠早於本紀年能計算的許多日輪。在第一卷卷軸、第一個故事之前，它像黑心在震動的天空中跳動。然而記憶根植我們骨骼，存在全龍族共通的深層記憶。遠古龍無言的哀鳴裡聽得見，倖存神祕龍沉重僵固的姿態裡看得見。每一萬代，幽蝕就留下不可磨滅的痕跡。","請聽清楚：幽蝕不可淪為傳說，不可只成為年老悲傷者口中低語的民間故事。它非常真實，我已竭盡所能，避免往事重演。我們不能遺忘。構成整個龍域基石的群月魔法，可能失效，也確實會失效。","上次幽蝕來臨，我還是幼龍。記得群月開始行為古怪，天文臺一片驚愕。起初細微。天文學家熟知五輪月穩定繞行龍域的軌道，發現它們偏離時記了下來：先風暴，再靈魂，逐漸五輪全變。他們警戒地被動觀望，似乎沒造成傷害，卻深感不安。","長牙龍 Rouk 第一個提出，必有不可見之物拉動軌道，是來自蒼穹外黑暗的訪客。眾人嘲笑！我慚愧承認自己也笑，以為那些霉味典籍讀壞了他的腦。他的話被駁斥忽視，直到月亮魔法出錯，才獲認真看待。","月亮魔法原本難測，群月各有意志。但日子流逝，更多令人不安的消息，連隱居天文臺都傳進來：占卜石給出混亂讀數，不穩定法術發生怪爆炸。更令人不安的是，月亮引力變動使信鳥迷途，潮水在錯的時間、帶著錯的顏色漲起。回顧時，幽蝕將至似乎再明顯不過；當時一切卻太緩慢，悄悄逼近使我們解除防備。如鍋中逐漸煮沸的蝦，等弄清楚時，為時已晚。","事情再也不能忽視，議會被召開。我當然無權參與，連旁聽也不准。不過沒關係，因為很快全龍域都將知道議題。許多天後，眾人凝重走出議事廳，宣布大家心底早知道的事：魔法正在失效。日益增長的不安化成恐慌漩渦。Rouk 被從鄉間提早退休生活請回——那原是既有體制為擺脫其不受歡迎想法而強迫的退休。如今無人再笑。他復職，得到所需一切，包括我這位私人助理與跑腿。","這不是我會自選的任務，在他手下工作也很艱難。只因我最年輕、資歷最淺，任務才落我頭上。Rouk 古怪卻和善，使我每天忙到結束、累得快倒。有時抄錄不懂的遠古祕奧圖表，鼻吻沾滿墨；有時在森林跑，查樹枝下方的苔蘚朝哪邊長。當時極度挫折，以為只是故意找事讓我忙。漸漸認識他，才明白每項追查都有目的。","大多數計畫 Rouk 不讓我知道，但一天苦工後，至少覺得已盡所能，略可安撫紮根內心的恐懼。他開始教我用來追蹤、預測群月運動的複雜神聖數學。他教得投入，我卻學得不好。挫折的長日延伸成挫折長夜，在粗大牛脂燭的黃光下對著羊皮紙苦做。我真懷念找苔蘚的日子。","沉默的急迫感籠罩 Rouk。許多夜晚我偷偷離開，睡幾個小時，早晨回來仍見他彎在計算前，從未離開。有天他把一組算式推來，只說：「檢查。」我不確定是否考試，小心接過紙，皺眉看。「我不懂，Rouk。這是八個引力相互糾纏天體的計算，不是五個。」「沒錯。」他回答，猛烈乾咳，離開房間。","我把紙拿到一翼遠，彷彿會咬，輕放繪圖板，決心油然升起。拿起羽筆，開始做。寫過一夜，又過一天，可能更久；工作深深吸住我，忽然不難理解他的長夜了。某時走到陽光走廊，眨眼、迷迷糊糊，對近窗流入的刺眼光芒瞇眼。有事不對。Rouk，我得找到他。","我趕到距天文臺不遠的私人書房，一爪緊抓皺巴巴算式，另一爪敲門。無回應。急迫使我膽大，逕自進去，看見他躺在床巢，正午如此十分反常；我太專注，忽略了意義。我揮動紙：「Rouk，這八體問題從哪來？我從沒看過這種東西。」「算式正確嗎？」「我的意思是，這不是……不會是……？」「算式正確嗎？」他堅持。「是，Rouk。就我能判斷，是正確的。」","他嘆氣，彷彿縮進巢，突然顯得脆弱，眼皮落成疲憊細縫。「Rouk，拜託告訴我這代表什麼。」拜託不要是我想的那樣。「既然算過，你很清楚。全面月蝕。不可見的天體將五輪月拉成一線，進入世界自己的影子；世界位在群月與太陽之間。八者筆直如搭弦的箭。群月將黑暗、毫無力量。這就是幽蝕。」","我沉重坐下，連日連夜工作的疲勞猛然湧來。我們長久無言，直到他劇烈、濕重、撕裂般地咳嗽。我才明白，自己真傻。「距月蝕只有幾週，」我虛弱地說。「而它一來，就持續十三天，孩子。」平時我討厭這種稱呼，如今卻真像孩子，恐懼孤單。我真正看著他，震驚於從前未看見的事：他正在消瘦，鱗片泛灰，眼睛混濁，太瘦，呼吸太沉重。","「你快死了，是嗎？」我無法掩飾沮喪。「很快。」尖酸又十足 Rouk 的答覆。「如果群月……如果祂們瞎了、沉默、暗下……」「就沒有復生。」「噢，Rouk！」我流下巨大的珍珠淚。他似乎不安。","「聽著，你正在用心思考，我需要你用腦。年輕學徒，必須接續我停下的工作。看見別人忽略的事，至關重要。現在想，這代表什麼？」他不給我沉思或悲傷的時間，有一刻我因此恨他。我抹乾鼻吻，深吸一口氣。想，這代表什麼？這會殺死 Rouk。他撐不到群月回穩，無法昇華為遠古龍或神祕龍。至少十三天，不能昇華，不能復生。不能復生！我瞪大眼睛如碟。他看我終於懂，只點頭。","「全龍域都會脆弱，」我說。「我們太專注群月，忘了考慮失效的後果。Rouk，我們該怎麼辦？」我記得那聲深沉空洞的嘆息。「事關重大，非去議會不可。」「遵命，Rouk。」那個最初走進他家的天真幼龍，與離去時心沉重的龍，已不相同。我依勸直奔議會，心跳猛烈，害怕不被聽見。我按他所教，冷靜合邏輯地說明。他們要答案，我卻沒有。","幽蝕真正降臨，龍域籠罩暗影。我們從未如此徹底失去月亮反射的光。白日也像有壓迫的昏暗懸在大地，夜晚漆黑。每位由單輪月亮魔法引領的遠古龍都失明了，恐懼發狂，號叫著橫衝鄉間。地震撼動城市根基，一些神聖神祕龍被震倒。那是混亂、令人心碎的時代。","最慘的是魔法停擺期間無法昇華的龍。他們並未單純死去。不論原本顏色，瞳孔都擴大成旋轉的黑色地景，點著虹彩。他們既非遠古龍、也非神祕龍，被稱為無名之月的僕從。也許全都失語，也許只肯彼此說話；他們發出喉音，沒有我們能懂的語言。","Rouk 變成其中之一。我在轉變後不久去住處遇見他；陌生雙眼陰沉望來，完全不再是自己。他咯咯叫了些什麼，蛇般繞過我，衝出入口。我再沒見過，只聽傳聞。幽蝕解除，這些未昇華的龍並未恢復正常；有人嘗試幫助，但僕從免疫魔法。他們聚集在龍域東緣未測繪山脈深處，不知做什麼，只知道以某種教團存活。此事太令我痛苦，因此不追查。","不幸在幽蝕出生的幼龍也出現神祕後遺症。長大時，皮膚染上同樣油膜般虹彩。他們碰觸不到群月魔法，如同僕從，魔法也碰不到他們。但他們常表現出對事物詭異的了解。被追問知識來源，有些只謎樣地答：「低語者。」大家以為他們精神有恙，我不確定。","他們多疑，只與彼此聚集，行動一致，近乎讀懂彼此想法。坦白說非常詭異，一般龍因此避開他們。現在還太早，不知將如何老去；但我害怕幽蝕的觸碰，仍以我們不懂的方式停留。","所以我寫下這些，希望未來能避開悲劇。留意失常魔法、不循正路的鳥、錯誤潮汐。務必知道，幽蝕將至。照顧虛弱者，不要讓幼龍在黑天出生。從我們遺忘之事學習。"],"bullets":[]
  }
  ,
  {
    "id":"ed-stellar-story","title":"星辰之鏡","en":"The Stellar Mirror","category":"expansion","kind":"譯文","source":{"book":"Encyclopedia Draconica","pages":"54–60","file":"encyclopedia"},"paragraphs":["首都首席天文學家「星眸 Cyriarc」日記；Brendan Conway 譯錄。「面對耀眼，太容易錯過微小的美；看見群月、愛祂們、讚頌、低語，卻漏掉旁邊成千上萬閃爍的星。天文學家的責任，就是向被強光蒙蔽者分享微光之美。」——星眸 Cyriarc。","暗影後六一八年，第四月二十八日：今日開始寫日記，記錄一次關乎希望、重新發現與驚奇的事業。我們將恢復龍域的一部分榮耀，為未來點光，以勇氣探索，使祖先自豪。戰前的龍造出今日幾乎無法理解的奇物。他們了解世界本質與外界空間。群月確實真實偉大，星辰也同樣解開謎、照亮深刻真理。","戰火與歲月使這些真理大量流失。如今成為天文學家，就是渴望往日奇蹟。我在首都身任首席，每日盡力觀測群月、繪星圖、標星座、查符文、造望遠鏡，同時思念那些曾遍布大陸每座龍堡的儀器，哪怕只得一小部分也好。如今！我爪中有一張從北方山脈隱藏的不破檔案庫出土的地圖，上有天文學家標誌，立刻被送給我。爪才碰上，我就認出：那是往昔最偉大天文創作發明的地圖，其中也許有最偉大的遠古天文遺物，星辰之鏡。光寫名字，鱗片就興奮發癢，如天真初鱗幼龍。","鏡的記錄零散，但我拼出一幅圖像：地面以月亮魔法平滑挖出半球形凹坑，鋪上最精良、反光的龍玻璃與水銀鏡。每面附魔，避免絲毫污痕，與其他鏡連成單一、平滑、無盡的整體。它們形成一碗像彎曲海面的鏡，永無盡頭地反映天空。碗正中央上方，由對應四方的四柱托起星辰之鏡本身：單片圓形折疊玻璃與水銀，薄如一張羊皮紙，完美清晰如晴天，極精細、完美地刻著星辰自己的符文。","天文學家站在碗中、鏡下。夜裡碗上的鏡只收集星光——附魔使它們忽略群月——向上投向星辰之鏡，再直射回天文學家。他仰頸，純粹星光傾瀉而下，使其與夜空無盡光點相連。找到鏡，就找回失落已久的一片文化，找回群月之外的世界。想像能使用星辰魔法，我們將造出何等奇蹟！","地圖指出方向、大概位置，但未知前路試煉。據傳說，黑暗企圖奪鏡，因它明白且畏懼星辰魔法的力量。少數故事提到某種充滿暗影的巨大蠍豹，永遠守著遺跡，不讓任何幼龍再度發掘。但我們不會止步，無論在哪都要找到，無論代價都要恢復榮耀。因為我們是龍，大地屬於我們，天空屬於我們，群月屬於我們，星辰也屬於我們。","暗影後六一八年，第五月十二日：沙漠！當然，鏡藏在荒地，頭頂無垠天空，哪還有更好方法接近星海、捕捉光？我與龍群循圖前進，彷彿又是替議會跑差事的初鱗幼龍：灰鱗帶紅紋的 Grimclaw；亮黃羽毛劃破空氣的 Siclariax；鞭狀帶刺尾、四肢修長纖細的 Anderfel。我是首席學者、唯一的天文學家，但興奮感染大家，連成共同目標。","鑽石沙漠的浩瀚使我們全都屏息，無一倖免。那是世間最美、最荒涼、最危險、卻又充滿生命的廣野之一。沙下呢？我們將在那裡找到鏡。期待使我連寫字的爪都顫抖！","暗影後六一八年，第五月十九日：我心情沉重。亮黃羽毛的 Siclariax 再也不能飛，為此行犧牲太多，我永遠尊敬。找到鏡後，全龍域都會尊敬。奪走飛行的是強大仙人掌犰狳。我以日月測量、確認位置時，牠從前方沙丘爆出，精準射出刺甲。Grimclaw 衝上鼻吻，Anderfel 用尾鞭吸引注意，但刺仍打中我的後腿。我倒在沙上，牠後足站起，躍來，要用刺掌把我壓碎。","最後一刻，Siclariax 一道金光飛來，推我閃開，自己在碎羽爆散中滾過，躺在沙丘，雙翼折斷。他未失去希望，眼裡卻有了暗影。我們在沙上前進，比從前沉默。但仍向前，為 Siclariax 找到鏡。","暗影後六一八年，第五月三十日：就是今天。古圖難懂，它以鏡所在地可見的星座引路。我盡力依星導航，成效有限。大家沮喪、悲傷，直到 Anderfel 想出妙計：據說有巨蠍豹守鏡，這野獸必定標記領地。仙人掌犰狳即使看見獵物，也會避開其氣味與存在。","花了些工夫，靠 Anderfel 的荒野本事及 Grimclaw 的勇氣，他們引一隻仙人掌犰狳追來。野獸追逐時忽然碰上無形界線、不再前進，他們就知道找到了蠍豹領地邊緣、鏡的所在地。當晚我確認星星，星座完全吻合。找到了。今天挖掘。今天讓鏡出土。Siclariax、Grimclaw、Anderfel 隨時準備應付蠍豹，我施月亮魔法抬起沙。就是今天。","暗影後六一九年，第一月一日：寫下這些，我知道將是本日記最後文字。不禁懷疑是否值得……但我有希望，我有希望。Anderfel、Grimclaw 躺在近旁。後者鱗片被蠍豹利爪割開；前者急促呼吸，蠍毒在血裡。Siclariax 努力照顧，也滿身傷、雙翼仍折斷。","我移開沙後，它就在那裡。鏡。與所知完全一樣：嵌沙的銀亮半球、托起上方結構的四柱，以及那張令人震撼、刻紋、極薄的玻璃。歲月與埋藏的沙全未傷它。美麗。我們歡欣，讚歎奇蹟。接著蠍豹憑空般升起，如蛇魚滑出沙，巨大如神祕龍，低吼，雙眼洩出暗影。","Anderfel、Grimclaw，甚至 Siclariax，都如此勇敢。他們全心戰鬥，召下最偉大的月亮魔法，驅趕、排出黑暗。我怕還不夠，怕野獸終將癒合、黑暗再長，但他們救了大家，付出自己的健康。我想……毒、痛、傷……他們時間不多了。但絕不讓勇氣犧牲白費，我要救龍群。天空無雲，夕陽西下，我知道該做什麼。","今晚站在鏡下，讓星光傾注，用其力量，一次耀眼爆發把同伴送回首都。在那裡，其他龍應能救他們，他們會活下去。我留下，研究鏡，守護、看顧它，盡力使蠍豹與黑暗遠離，避免鏡再被埋，讓後來者找得到。我將日記交 Siclariax 帶回，讓大家知道我們所做、所發現的事。為龍域，為朋友，我做這一切。為自己……我做這一切。願群月與星辰與我們同在。","編者記：星眸 Cyriarc 的日記至此結束。Siclariax、Anderfel、Grimclaw 帶著日記與地圖回家，在銀色星光爆發中出現。星光已療癒他們；Siclariax 雙翼重生羽毛，又能飛。他們向議會報告，長老卻認為再派遠征尋鏡過於危險、代價太高，儘管三者抗議也不改。此後，再無人見過星眸 Cyriarc。"],"bullets":[]
  }
]
