[
  {
    "id": "ed-kebros-story",
    "title": "Kebros 家族",
    "en": "House Kebros",
    "category": "expansion",
    "kind": "譯文",
    "source": {
      "book": "Encyclopedia Draconica",
      "pages": "86–94",
      "file": "encyclopedia"
    },
    "paragraphs": [
      "Kebros 家族先知團的 Kallen 著；John Wick 譯錄。「Flyreign 失敗了。因為軟弱，所以失敗。選擇救朋友，而非龍域，我們不得不補償。有多少人因此死去？幾百？但英雄卻是他。歷史就是如此，選個英雄，講他的故事。好吧，這不是 Flyreign 的故事，是我們的。讀完，也許你會更清楚理解自己的故事。」——Kebros 家族的 Shadowburn。",
      "我知道別人會怎麼看待我的證詞。我的條目將與這個版本大不相同。我知道他們會改字，使其符合自己對歷史的理解。我接受。你們不想知道真正歷史，只想要強化既有信念的故事。但我必須如實面對自己，如實面對你們，因為我們一族首要美德，就是誠實。龍卻寧信美麗謊言，不看醜陋真相，我們就是如此。很好，開始吧。看看你們能忍受多少誠實，才非移開目光不可。",
      "我叫 Kallen，是自己選的名字，是述說內心靈魂的龍名。隨你如何解讀。我要寫下家族歷史。",
      "戰爭之前：曾有黑暗尚未來臨的時代，我們都清楚、直白地說話。流血山的心臟深處，有紅寶石池，燃燒的紅色液態岩石。池水低語。火焰表面深處，躺著將自己獻給池子、使我們能看見的那一位：紅寶石火焰的神諭者。我們向其學犧牲、學真相、學一切。因祂，我們被稱作紅玉家族。誠實、真相，是眾人形容我們的詞。我們是顧問、先知，因奉獻受尊敬。但後來……啊，還沒，快了。",
      "先知團：團體仍在，卻不再像從前。大背叛之後，再也不同。想加入者必經試煉、磨難；如同神諭者為我們受苦，我們亦須為祂、為智慧、為真相受苦。你被蒙眼綁縛，帶進洞穴，先知唸詞，取下眼罩。然後……然後……你受試驗，看見事情，可怕的事情。你的未來，所愛者與所恨者的未來。永無機會分享的喜樂，無力阻止的疼痛。知道未來，不代表自由。不……",
      "看見且為之受苦者，可能得到智慧。夠資格的，走出時雙眼如紅寶石火焰；不夠資格的，再也看不見。我們先知走向世界，擔任顧問嚮導。我們不最強、不最快，也不如別人善戰；卻知道其他人不懂的秘密，預見他們忽視的危險。我們站在英雄身旁，從不自稱英雄，也滿意於沒有自己的歌、自己的故事。安靜站在勇敢大膽英雄身後的顧問，就是我們的角色。知道我們的人會懂，那就夠。",
      "大背叛：我們最先看見，在世界邊緣成形，聚集於無人敢看的暗處。我們最先警告，在大廳說出將到之物。但你們不聽，只唱歌跳舞，無視異象警告。敵人逼近，我們最先與它交談，最先稱其名：「黑暗。」也最先稱它為：「朋友。」",
      "我們給它祕密，但不太多；給它名字，但只是弱者名字；給它力量，但只是能取回的力量。你們全不聽，黑暗知道。為何先找我們？軟弱？不。愚蠢？不。因為我們強大，因為我們睿智，因為你們無視警告。當它低語，請我們結盟，給美麗承諾……我們微笑點頭。",
      "我們接受力量嗎？是的。給它城門鑰匙嗎？是的。等它擊敗你們所有人，是誰割了它的喉？我們。",
      "第一次暗影戰爭：家族站在黑暗這邊。雙翼附著詭異黑夜，我們飛過夜空，成為恐怖化身，比從前更強，比你們都強。在雪峰之戰首次翻牌；我們與你們並肩等敵，自己的斥候報它將至，我們一起等。噢，如何等待啊。",
      "我們的新形體，藏過你們的眼鼻。你們談手足情、談團結，在忽略、嘲笑之後，直到危險當前、龍命已失，才叫我們幫忙。我們就在那裡，翼並翼飛著，你們微笑，說漂亮話。黑暗露出真面目，我們也露出，焚暗之焰燒向你們。困惑痛苦的尖叫，混著我們看你們如垂死餘燼墜落時的笑聲。黑暗低語我們的名字，新名字，我們唱它的歌、空中起舞。",
      "你們叫我們叛徒。對，背叛了你們，因為你們選擇不聽、選擇嘲笑。黑暗聽了，沒有笑，在耳邊低語、撫摸鱗片，說世界將屬我們。而它從不說謊。它從不說謊。",
      "犧牲：戰事持續，慢慢，極其慢地，你們開始取得進展。想過為何？以為是精采戰略、勇氣、爪牙、吐息？不是，是我們的背叛。我們悄悄破壞黑暗，悄悄削弱力量，悄悄磨鈍利爪，讓牙齒折在我們設的陷阱。沒有我們，你們的勝利毫無意義。黑暗對你們太強，對所有人太強。我們知道，看見，神諭者警告過。我們知道如何顛覆、瓦解，而那將流血，太多血。我們願意，為你們。",
      "為了讓你們得到維繫希望的勝利，我們流血，失去多少性命。我們為你們流血，拋棄尊嚴，獻出生命，好讓暗影戰爭結束。但後來……但後來……",
      "Flyreign 的失敗：Flyreign 失敗了。最後之戰，他失敗；軟弱幾乎毀掉一切，遲疑、失敗。最後只讓我們付出一條命，但可能更多，可能所有人。紅寶石火眼讓我們看見決戰、他必須做的事。時刻來到，他不願犧牲，為少數人危及所有人，離開戰位去保護……那錯誤幾乎終結戰役。黑暗本會贏，本該贏，若非我們。",
      "救大家的是我們的血、痛、犧牲。因他的軟弱，我們不得不太早揭露對黑暗的背叛，因而幾乎失去一切。Flyreign 當天死了，成為你們英雄。不是我們，不是群星慰藉，不是智慧笑語，不是希望之錨。不是……不，我連名字都寫不出。",
      "我不想讓你們記住那一位，因為你們會詛咒其名，「背叛策畫者」。你們永不會以應有敬意說出名字，所以我不寫。割敵喉者，承受其血者，承受其喪鐘者，那一位……你們不配記住。自那痛、背叛、血的日子，世界全變了。紅如紅寶石的血。",
      "最後啟示：近年神諭者聲音轉弱。我們到火湖，只聞低語，話愈來愈晦澀，半是妄想、蛛網似的胡言。終於最後一次：「我看不見。另一個……」我們聽著等待，沒有更多，只有沉默。一句逗號收尾的話懸著，如未完全折斷的樹枝，在強風中晃。我們等幾小時、幾天、幾月，只有沉默。",
      "那就是將自己獻湖、使我們能看見者的最後啟示。消失。不安定火焰下，一片寂靜。自此我們爭論該怎麼辦。有人說須另有人取代，有人說只有原來那位能擔任。有人驚恐，其餘全恐懼。應另有接替者嗎？那是祂……我們不知道。第一次，不知道，不知道。",
      "失明的我們，在黑暗踉蹌，沒了火湖之聲指引。只有不確定的黑暗，只有自己，以及不信我們的人。還能如何做一直以來的自己？拿走眼、舌、鼻，我們是什麼？無聲，無法看見，也無法嗅聞。只有黑暗。只有，黑暗。你問如今 Kebros 是誰？我們一如以往，也前所未有。",
      "先知團仍在，仍像從前侍奉英雄，仍告訴你真相。指引的聲音卻已不在。有些人想指引，當新聲音，但不是神諭者，誰都不能是祂。尋覓者希望找到夠資格者取代，但即使找得到……誰有勇氣走入紅寶石火湖？我們一如以往，前所未有。我們是先知，願為智慧付出任何代價。也會背叛你，為了拯救你。"
    ],
    "bullets": []
  },
  {
    "id": "ed-legends-story",
    "title": "傳說與學識",
    "en": "Of Legends and Lore",
    "category": "expansion",
    "kind": "譯文",
    "source": {
      "book": "Encyclopedia Draconica",
      "pages": "95–101",
      "file": "encyclopedia"
    },
    "paragraphs": [
      "抄寫員 Merith 記錄；Michelle Lyons-McFarland 譯錄。「Syraah 揚聲，千道微風嘆息、千團火焰怒吼、千串風鈴鳴響；全世界靜默，為了更清楚聆聽非凡之歌。Cereth 抬頭，流下一滴孤寂的淚。」——〈Syraah 之歌〉。",
      "許多人知道最初龍領主的故事：古老、強大的龍，高站伸翼揚爪，家族以其名成立、以其榮光雕出整個龍域，從原本無名的荒野中——因為當時無人能為之命名。Tessith 仍有家園，Kebros 尚未在黑暗跌倒，那是傳奇年代。幼龍在知道自己家族之前，就在出生龍群聽這些故事。名字活在年幼者舌尖與年老者心裡，如暮煙自沉睡大地飄入她的愛侶天空心中。",
      "但領主故事並非最古，雖最著名，卻非最早。當 Brynbak 在第一次暗影戰爭領軍衝鋒、Rothscar 首建紫晶塔、Myndoth 首呼虛無之月護佑所有人時，這些更古老故事大都已被遺忘。古老真理藏在往昔珍寶之下，等新月照耀，重新發現。",
      "世界年輕、群月尚未從初龍孵出，我族漂流遼闊水域。工匠以木與魔法造船，大到裝得下整個龍族。我們沒有家，只帶著航行的家；沒有家族、沒有諸道、沒有土地。但有人相信還有更多，相信某地能建造世界，停止漂泊。",
      "漂泊者之中，有一個特別龍群，受賜一艘小船，被派去朝聖、證明自己。最受尊重的成員是後來稱探索者的 Celmoth、先知 Cereth、戰士 Felsheth、歌者 Syraah。四位同伴一起誓言：要贏得自己的鱗，否則沉入水的懷抱。於是永恆星辰引路，向夜航去。",
      "Celmoth 是領袖。夢裡看見龍族能休息成長的土地，從未見過：高到爬不上的浪，凝固卻不冷。長老不信，聽來像雛龍幻想。但他不能放棄，召集龍群，去證明自己，找地平線外的家。",
      "四友面對許多危險，多數消失在時間記憶霧中。少數仍知：Felsheth 找到真實渴望的失夢島；Cereth 從空無天空召雨、救大家的無盡乾渴之海；Celmoth 幾乎溺於火焰的烈風風暴。他們經歷、存活一切，直到某天，靜海彼端出現不會倒的浪、不會動的雲。",
      "Cereth 遭強烈異象攫住，幾乎看不見眼前，只見綠島上金塔城市，如不可能高大的船桅。Syraah 唱歌引大家靠近越來越大、越來越暗的巨塊。Felsheth 準備戰歌，整鱗迎險。Celmoth 認出夢的浪：土地高得最大長老龍也渺小，山像沉睡龍頭。他知道回家了。",
      "四者登岸紮營，警戒、不確定前路。土地無盡，海岸左右都望不見盡頭，森林似不可穿，升上山坡。Cereth 說出異象，指他們應找龍嘴的洞，裡有水晶可證明發現；帶回便能引族人回家。他們深入今日稱龍口的地方：Casek 山頂洞穴，瀑布從雙石間傾下，落到遠處深藍池。",
      "洞向山中延伸，淺溪隨幼龍腳邊流過。抵後壁，他們發現兩件事：溪水源頭是一口永流泉，當天由 Cereth 命名「生命之息」。另一件，是泉上牆裡嵌著水晶，顏色無法形容；聚集外面微弱天光，柔和放大照亮石壁，顯露金銀礦脈。Cereth 立即認出夢中晶，撲去，決心拔下帶回族人證明。",
      "Felsheth 拉住他，指出危險。「移了水晶，牆可能垮，石後水會噴出，把我們全沖下山。先想一想，Cereth。」Cereth 退開，外表冷靜，心已憤怒。眾人不知，黑暗找到其傲慢、腐化成執念。他走向洞口，陰沉思考如何最好完成任務；Celmoth 則想如何幫忙而不讓大家送命。",
      "Syraah 凝視水晶，看出真相。它柔光映著水，下是流水，後是含金屬碎光的黑牆，多像低懸夜空、看著水中倒影的敬愛月亮。那是堅石之月，保護新土地與族人；取走即褻瀆。",
      "「Cereth，看不見此地祝福嗎？異象引路正確，含義卻被扭曲。水晶不是獎品，是承諾。不能帶走，我們的話已足夠證明。」「不，」Cereth 低吼。「我看見真理。長老以為我們傻，必須讓他們相信！」Felsheth 看見眼底黑暗，爪放腿上。「不能屈服絕望，我們會成功。」「這不是絕望，Fel。還是該叫你蠢貨？那麼輕易放棄任務？幫忙取寶石，否則滾開！」他露牙冷笑，暗影吞掉眼中藍寶石色，爪劃過 Felsheth 腿，鮮血湧出、對方倒抽氣。",
      "Felsheth 後退，伏成戰姿，瞇眼嘶道：「為救大家，我會做認為必須的事。」Celmoth 插在兩者之間。「別這樣，Cereth。友誼比石頭珍貴。我們發現新土地，別以憤怒流的血為它祝聖。」",
      "Cereth 已無理智，內在翻騰黑暗催他瘋狂，揚爪衝向 Felsheth，推開 Celmoth。Felsheth 轉身，利爪刮過鱗片。這是同伴第一次彼此攻擊，認知使他心痛。Celmoth 不敢插手：Felsheth 不肯拔武器傷友，Cereth 又不退；若衝進去，恐分散防守者注意、後果災難。",
      "兩者來回騰挪，Felsheth 始終擋在友與晶之間，Cereth 則無情揮爪，是暗影怒氣驅使的腐化靈魂。Syraah 急得流淚，想使友清醒、避免更多血。他回望水晶，求堅石之月指引。在刀響與嘶息間，聽見一個安靜音符隨風吹過泉水，便明白該怎麼做。",
      "他低頭向溪，讓淚融入大地之水，然後抬頭，向天空之風吐息。如同之前無數世代，唱風與水的歌，讓月亮魔法流過嗓音。拍翼造心跳，吟音與風和諧，低吼字句替石發聲。水晶回應，愈來愈亮，隨歌震動，搏動光與生命。Felsheth 垂頭致敬，靜止；Celmoth 閉眼展翼，靜止。",
      "Cereth 拔刀衝前……一道晶光觸及，他也靜止。一滴淚滑過臉，鱗上留下金珍珠之痕。面對 Syraah 的歌，黑暗離開。他看見 Felsheth 肢體上的傷痕，以及那雙因疼痛而瞇起的美麗眼睛；看見 Celmoth 高貴姿態中的勇氣信任，跪下哭，知道多近就要摧毀大家。",
      "Syraah 歌聲更強。水晶閃耀，眾目炫花，牆裂，噴泉湧出。歌從龍口隨霧而出，亮起族人的色彩，水流造出至今流過首都旁的 Thenos 河。歌將荒地變成我族之家的龍域，救祖先免成弒親者與黑暗第一位犧牲者。那第一位，後來是另一個迷失自身暗影的靈魂。但那是另一個故事。"
    ],
    "bullets": []
  }
]
