[
  {
    "id": "ed-seekers-story",
    "title": "尋源者：童年神話中流行的尋覓者故事",
    "en": "The Seekers of the Source — Popular Seeker Stories in Childhood Myth",
    "category": "expansion",
    "kind": "譯文",
    "source": {
      "book": "Encyclopedia Draconica",
      "pages": "115–121",
      "file": "encyclopedia"
    },
    "paragraphs": [
      "花崗岩議會大學傑出兼任研究教授 Liminous 著；Jonathan Perrine 譯錄。「這份所謂報告，出自一名『議會之眼』探員，在灰燼堡壘尋獲。請注意，議會公開這番奇想描述，並非為刺激讀者。古老規則束縛議會雙爪，所有文書均須公開，無論多荒謬。」——議員 Brassheart，〈探員 Tazel 最終報告〉第一卷序言。",
      "認真觀察議會程序與邊境報告者，會注意到秘密集會、黑暗儀式傳聞偶爾藏在日常瑣事間。這類故事依規定須調查，也與新孵幼龍聽的故事多有共通。幼時吸收家族文化，恐怖故事同樣染上信念責任。合看便是一組「作品」。分析它們，也許能更了解社會。本釐清編目計畫持續進行。若其他學者持有書目未收作品，請寄研究棲位：花崗岩議會大學，傑出兼任研究教授 Liminous 收。",
      "第一部分：「尋覓者」及記述共通處。從成千虛構軼事挑一常見類型，有助揭示其愚昧、剖析目的。以常出現的團體「尋源者」命名的「尋覓者故事」，就是假定有一群龍知曉黑暗、或與之互動的教團。通常，一位陰影般探員引一隻幼龍入會。教徒從不著名，總聲稱自己及門徒遭不公，失去應有聲名，因此必被選中承擔更崇高的祕密使命。接著揭示使命：收集、淨化那些從戰時囚禁窖藏滲出的黑暗碎片。刺激、危險，而且完全不真。",
      "第二部分：囚禁論。教徒常提出下列變體論證：兩海之間全是龍域，我們掘地、飛山；若驅逐某物，例如黑暗，它還能去哪裡，才讓我們安全？「囚禁派」相信，Flyreign 勝利之前，有些龍絕望地封存黑暗碎片，救龍免遭其害，卻也使黑暗躲過戰爭最後一擊，如今正在「洩漏」。對，聽起來多荒唐，就多荒唐。每隻龍都知道黑暗已從存在中抹除，任何配得上自己雙翼的學者，都不支持囚禁論。",
      "常見的所謂囚禁地候選：崖谷殖民地——請記住，那是邊境的和風舞者、藝術家社群。調查早已認定，崩毀是粗劣工藝的必然結果；毀掉這魯莽社群的是遠離首都建築法規，而非 Skyfear 將軍把峽谷壓到黑暗巨獸身上的瘋狂計畫。風信子深淵——紫花滿布陷坑周圍，至今土乾危險。從未找到任何神祕龍自稱是、或認識那七位據說獻身群月、把黑暗綁在花根的長老。兩百年前遠征，在基岩上只挖出破黑花崗岩。墨井——要塞寡言工匠從沒記錄古井深處藍水有何異常，更別說危險。純山雪融水唯一特色，是能保持濃色，適合製作學者議員普遍用的墨，我自己也用。",
      "第三部分：採樣與「判源」儀式。傳說宣稱，黑暗不能永遠囚禁，終將逃出，起初緩慢，終究打開地下牢門。故事中，尋覓者收集從這「源頭」逃出的東西。每逢不安或腐化傳聞，就有幽影尋覓者來採「樣本」。依故事可能是黑暗碎片或容器；浸滿黑暗的物品，不管吸收力如何；因不潔行為或情境腐化的古物；或真的遭黑暗碰觸的龍。",
      "為何冒此風險？為了匯集樣本。幾乎所有故事都說送至中央地點，為何？這帶到最怪元素「判源」。數百篇中，直到這裡才提到群月恩賜的占絕大多數。它們認為可在多位神祕龍面前施特定儀式；樣本夠多，就能利用內在模式追溯原點——逃出的牢獄。如同囚禁論例子，這些主張與基礎都不真，任何一項都足以質疑團體存在。合看證據，更壓倒性顯示這些是刻意編造、利用恐懼與刺激需求的故事。",
      "第四部分：驅散尋覓者陰影的真相。敬畏黑暗、認定它必逃，是孩子氣；是把睡前故事、單一傷痕累累戰場先知 Flyreign 的話，拿來對抗悠長龍史。沒有硬證據顯示戰後有任何古敵碎片逃出；顯然已根除。戰時可靠記錄只提黑暗造物及受影響生物，未提物品污染。「邪惡甕」之類古物，尤其僅因靠近戰時暴行就危險，肯定是嚇幼龍縮回被窩的捏造。",
      "相信這些故事，就是抹黑讓貨物運遍龍域的勇敢聰明龍。暗示軍需官信差權力，故事要我們相信，處理日常貨運者都以某種方式被大陰謀滲透。如此重要組織的黑暗倒影，怎可能無人注意？再看最奇怪假設：需多位神祕龍、在龍域視線外進行的判源。每隻龍都敬重神祕龍，記錄細密；龍群怎可能容長老失蹤無聞？祂們為群月發言，但大批尋覓者故事中，沒有一篇清楚連起尋覓者動機與完成儀式必需的月亮代理者。",
      "第五部分：結論。換鏡頭再看：被困室內的議員，及邊境追求冒險的斥候。一方多半人生服務首都，另一方在現代受訓戰士已少的情況下，選最危險駐地。他們可與故事裡年輕門徒對照，必都記得幼時刺激危險故事，及成年進入適當職位後火焰如何熄。渴冒險、向議會上級報告大故事的外在好處，都是故事長存不能忽略的動機。",
      "其實傳播模式明顯：相同斥候議員，常用同地區反覆「證據」、軼聞強化故事。頻率更集中於偏遠交叉路口要塞，外界消息稀少，近事也可能幾週才傳到。就在乏味驛站倉庫，荒唐故事萌生；誰不想用正常送信以外的刺激，不論真假，打破單調？",
      "沒有堪比上戰的大事，我們便渴望巨大悲劇。故事給揭開不懂之物運作影響的刺激。對那些其實死於地質與自信過度的龍、命運終究平庸的社群，黑暗成了刺激、充滿神話的代罪羔羊。",
      "我們珍視其刺激敘事，作為繁榮閒暇時的娛樂，適合夜裡火盆旁互嚇。但別讓假裝能力，分散對龍域的服務，也別妨礙享受自上次真正鬥爭以來，長年共建的世界。"
    ],
    "bullets": []
  },
  {
    "id": "ed-reckoning-story",
    "title": "Fostr 柔爪的艱難試煉",
    "en": "The Tribulatory Reckoning of Fostr Softclaw",
    "category": "expansion",
    "kind": "譯文",
    "source": {
      "book": "Encyclopedia Draconica",
      "pages": "122–129",
      "file": "encyclopedia"
    },
    "paragraphs": [
      "Theropsida Blackscute 著；Jason Morningstar 譯錄。「試煉？噢，我那時難多了。如今新幼龍過太輕鬆，鐵砧峰把他們當剛孵似地寵。我看過大 Reykurinnhol 前廣場的鋼鐵試煉，真可笑。我參加時，那是領導力的熔爐，許多失敗。我們敬畏、恐懼地等候，賺來柔爪之名。這些幼龍？竟擁抱合作與公平競賽，荒謬！」——尊者 Accipiter Catulos。",
      "艱難試煉：Semscale 長老 Fostr 柔爪全盛時，創造一系列測試，挑戰來自全龍域的幼龍龍群，成為最好的自己。它成為各家族有志幼龍出世前的成年禮，世代相傳，至今熱烈施行。不容易，很少人通過。過者雖非正式，卻受敬地稱為「柔爪」。柔爪應幫忙主持未來試煉，成為從 Fostr 古時延續、精英而神聖團體的一分子。雖無官方效力，此名讓人在龍域任何地方都能向其他柔爪求住宿、援助、建議。",
      "試煉在偏遠 Semscale 要塞鐵砧峰內外、地下舉行。居民擁抱這程序，既鼓勵，也享受幼龍在市場、大廳、巢舍裡意志堅定地跌撞。每年題目不同，柔爪與居民合作，努力使各關挑戰、意外。共六關，一關保密；全在年長柔爪監看下，從不意圖非常危險，可能傷人，絕不危命。本質是一場全鐵砧峰都參與的大遊戲。有時明顯一面倒！",
      "鋼鐵試煉：幼龍必須展現禮儀、尊重、領導。總以社交挑戰開始，轉成非領導不可的局勢。著名例〈學徒叛亂〉，學徒抗議工時長、露蜜酒與鱷牛腿供應少，起身反師。龍群須仲裁，當一群暴躁學徒依預先劇本暴動，又要帶領高等衛隊平亂。",
      "另次，幼龍被「從試煉叫走」，擔任高階家族外交官的副官，協助重要貿易協議。所謂外交官一律無能、放蕩，或因其他原因不能盡職，非倚賴幼龍不可；後者既要以最合禮方式使他們別惹禍，也須直接協助艱難談判。",
      "橡木試煉：幼龍必須運用技巧，解開重要古物。傳統是冒險挑戰，需要戰鬥、團隊，可能謎題、解難。常被溫暖懷念的〈夜之錢袋〉，由絕望 Myndoth 探員求助，取回被野心幫派偷走、珍貴的「虛無之月古物」。龍群須解失竊現場線索、找到、對抗、擊敗幫派。此關總排較早，目的讓龍群聚合，形成有效率、有精神的團隊。",
      "黃金試煉：幼龍必須為不可能謎題，找到或造出創意解答。總是簡單、卻無明顯解法的挑戰：跨越不能架橋的深溝、唱出不能唱的龍歌、擊敗無敵者，或比龍飛行更快到遠地。答案總簡單得騙人，只要橫向思考。著名深溝用飛行蛾象帶過一根絲就搭成橋；規則沒說橋須承龍重。同樣，無敵者不可能所有領域都無敵，幼龍要找弱處、在那挑戰。勇猛戰士可能不擅修辭競賽，但試煉不會提。全龍群技巧機智，是成功關鍵。",
      "鑽石試煉：幼龍必須學會並非每挑戰都能贏，承受失敗後果。這是殘酷、刻意設計的打擊，要讓龍群毫無成功希望。幾年前是長距滑翔賽，對手「當地人」其實是王國最優秀年輕上升氣流滑翔者。另年是假戰鬥，考生背沉重「珍貴典禮盔甲」，還禁止損壞。永不公平，通常在青年最驕傲自滿時安排；尤其討厭的年份，還鼓勵為必勝下注。",
      "此關以團體挑戰呈現，常在中途、士氣高、團隊已形成時。它是主題轉折，代表輕鬆好時光結束，更黑、更危險、更吃力的關卡開始。每個龍群處理設計好的敗局不同；這熔爐鍛造、也摧毀終生友誼。高昂、良好地走出，幾乎都興盛；心灰、互相怨懟，幾乎都失敗。許多居民不願見它毀掉原本很好的龍群，有些心軟者事後盡力減輕衝擊。",
      "祕密紅寶石試煉：幼龍必須辨黑暗、拒誘惑，也信任同伴會如此。從不宣布，安排每隻在不同時間面對。目的是看個人對抗內在黑暗，實質是向考生提出倫理問題。有時簡單，有時繁複，永有灰色與難選。",
      "「團隊任務到了關鍵前夕，一位年長柔爪拉你離開，要求按書皮顏色重排圖書館。」你會忽略眼前責任嗎？「私下用餐，高等衛隊長隨口說，你的同伴私底下為最近一次尷尬失敗怪你，還嘲笑表現。」你會對朋友發洩嗎？",
      "「總主持 Accipiter Grimmur 評估表現，單點你是弱環節，特指一項明明是別隻或全隊錯的失誤。」你會把龍群拖下水嗎？「地方商人給你下一關線索，能以重大個人代價輕易破解。使用至少受傷，也許更糟，但龍群輕鬆過。」你會採自毀行動嗎？「Skemmtilega 旅店老闆 Lemell Karst，聲稱與某家族同盟，悄悄提供最好房、蒸汽浴、大餐，條件是獨自來。」你會與龍群孤立嗎？",
      "每題答案都該是「不」。沒能抗黑暗，最後便不及格，不論團隊多好。Grimmur 會訓斥失敗者，給一次機會：其餘同伴願意維護接納，就能成暫定柔爪。目標非懲罰，是使其知戒。通過者當然發誓保密；知道會有紅寶石試煉的幼龍，很容易通過。",
      "翡翠試煉：幼龍必須整合全部教訓，在多路中選前路。最後一關，過程一直被恐懼提起：「這是難，但翡翠更糟。」「現在很得意？等公布翡翠。」給三路，暗示僅一條成功。著名一回，疲累龍群到鐵砧峰腳森林路，得知正路末端有柔爪等待接納，其他路則帶他們遠離鐵砧峰、恥辱失敗地回平庸日常。深林分三岔，標「友誼」「責任」「勇氣」。三路一律通入儀式，輕鬆喧鬧——當然，假設全員過紅寶石。翡翠更像課，而非考。",
      "接納儀式：先在翡翠後立刻瘋狂派對認可新人，再於 Reykurinnhol 廣場正式行禮。最年長柔爪向通過全關者授名授榮，隨榮有責：其他柔爪呼喚，務必回應，盡可能給住處與援助。對新人也許更重要的是，在鐵砧峰與其他地區資深龍溫柔指導協助下，籌辦明年試煉。",
      "「我的入會？完全混亂！居民剛才還騙我們是兇海盜、家族長老、暴動學徒、真得可怕的機械怪物，翡翠後卻帶整桶露蜜酒、真情迎來。他們把心魂投入考驗，當然為努力及我們成功自豪。後來——喝那麼多酒，狀況當然糟——叫我們盡量整潔，去大 Reykurinnhol。幾十位柔爪等著，面貌嚴肅、禮服華美。能獲如此尊貴同伴接納，我們何其驕傲！當然，很多已變，鐵砧峰非我當年，但仍盡力使新柔爪達到某種體面。我想，他們也以自己的方式賺來稱號。」——尊者 Accipiter Catulos。"
    ],
    "bullets": []
  }
]
