[
{"id":"gm-hazards-introduction","title":"危機：讓世界持續變動","en":"Hazards · Using Hazards","category":"hazards","kind":"譯文","source":{"book":"Epyllion 核心規則書","pages":"129","file":"core"},"paragraphs":["第一場之後，龍主手裡會有許多值得延伸、追蹤的故事線。龍群可能想替議會尋回失落聖物、追捕試圖破壞月光節的離經叛道之龍，或追尋創角與第一輪場景中暗示的其他線索。","抵抗『編排劇情』的衝動：別預先決定每場必定發生的一連串事件。龍域太廣大，無法裝進一個人的腦袋。若總在盤算如何把小龍帶到某個指定場景，故事會顯得造作，像被硬推上他們完全不感興趣的路線。","讓故事保持新鮮、持續演變的方法之一，是使用危機：這個簡單工具幫助你追蹤龍域的衝突，無須把一切排成劇情。它讓龍群周遭的世界持續運轉，又不犧牲『大家都在遊玩以探知後續』的原則。龍群會因你創造的危機而團結、聚焦；你也不必把完整劇情與轉折塞在腦中。"],"bullets":[]},
{"id":"gm-creating-hazards","title":"創造危機與選擇類型","en":"Creating Hazards · Choosing a Hazard Type","category":"hazards","kind":"譯文","source":{"book":"Epyllion 核心規則書","pages":"130–131","file":"core"},"paragraphs":["每個危機都是給龍群的獨特挑戰。沒有人處理，它就沿自然發展升級；龍群選擇介入，便有力量影響結果。危機形式各異，規模從單隻小龍的個人難題，到影響整個區域的環境阻礙。","一般而言，龍群應能在一場內解決單一危機。有些能持續更久，但整體應有單元式、可達成的感覺。剛開始冒險時，危機要像小龍一樣小，反映他們能克服的問題。隨年齡增長，危機仍應與其興趣、在龍域的地位相關。例如照顧年幼小龍的責任，就應影響遭遇的危機。","自行創造危機很容易！短暫休息就能即興製作；需要更多時間，也能在場次之間準備。第一場以前可先做一個，讓衝突隨時可用；遊玩一陣子後，幾乎肯定還需要更多。準備好時，依以下四步，創造自己身為龍主覺得有趣的危機。你熱切想主持，玩家多半也能感受熱情，隨之展翅。","危機分為家庭、友誼、傳統、自然四種類型。類型界定用來推動危機的主題與慣用元素，並非具體形式。它可以是一條龍、一場儀式，甚至荒野野獸！類型描述龍群要面對的衝突種類，卻不決定在哪裡遇見、如何解決；那些由你與龍群決定。","選擇類型——也就是單元衝突的架構——之後，再選子類型。各子類提供一組本場可用的龍主動作。例如想以龍群的一位 NPC 朋友為中心，可以選友誼危機、『嫉妒』子類，指引關係如何發展。","每個子類也有一項『本能』：類似 NPC 欲望的驅力。危機中的龍仍保有個人欲望，但你的工作，是讓整體危機透過龍主動作與危機動作實現本能。每當危機出現在故事裡，就把注意力帶向符合本能的衝突、危險與謎團，呈現其核心。"],"bullets":["1. 選擇危機類型與子類。","2. 創造有各自欲望的 NPC 陣容。","3. 把利害關係分配給月相（選用）。","4. 設計所需的自訂動作（選用）。"]},
{"id":"gm-hazard-family","title":"危機類型：家庭","en":"Hazard Type: Family","category":"hazards","kind":"譯文","source":{"book":"Epyllion 核心規則書","pages":"132","file":"core"},"paragraphs":["家庭危機聚焦親合龍群、其小龍與家族延伸關係之間的挑戰、緊張。有時關乎痛苦的分離或失落，也可能關於緊密家庭羈絆的陰暗面，或龍族如何面對小龍長大。","子類：分離（本能：分割一份寶藏或其他資源）；疏離（本能：與所有人保持一翼之隔）；悲傷（本能：不計代價地避免和解）；控制（本能：不讓任何事成長或改變）。"],"bullets":["有意或愚蠢地毀壞某物。","公開宣告隱藏的感情。","拒絕援助。","請求援助。","提供幫助，卻附帶私人牽扯。","談論同伴的八卦。","強迫在兩條龍之間選擇。","倚靠一段親密關係。"]},
{"id":"gm-hazard-friendship","title":"危機類型：友誼","en":"Hazard Type: Friendship","category":"hazards","kind":"譯文","source":{"book":"Epyllion 核心規則書","pages":"133","file":"core"},"paragraphs":["友誼危機聚焦朋友與龍群同伴之間的艱難關係。交朋友容易，有時卻必須努力爭取，才能留住。維繫友誼的事——花時間聆聽、歡笑、建立連結——也能修復嫉妒或其他不安全感造成的傷害。","子類：嫉妒（本能：摧毀他者所有物）；競爭（本能：不留情地爭取勝利）；匱乏（本能：囤積有限資源）；不安（本能：以出格行動證明別人錯了）。"],"bullets":["把小衝突升級為大衝突。","在觀眾面前展現長處或不安全感。","堅持幫忙解決問題。","固執地一試再試。","盡可能善意地解讀事情。","誤解計畫與謀略。","挑戰某人參加比賽。","要求某人在朋友之間做選擇。"]},
{"id":"gm-hazard-tradition","title":"危機類型：傳統","en":"Hazard Type: Tradition","category":"hazards","kind":"譯文","source":{"book":"Epyllion 核心規則書","pages":"134","file":"core"},"paragraphs":["傳統危機聚焦龍域的儀式、傳統與政治程序。小龍經常與看似過時、守舊的傳統衝突，但改變做事方式，比想像中困難。","子類：階序（本能：使一切各居其位）；傳承（本能：拒絕改變）；限制（本能：灌輸對未知的恐懼）；儀式（本能：不加思索地服從）。"],"bullets":["緊抓理性或傳統不放。","公開而混亂地打破傳統。","提醒某人自己的地位。","要求為過錯或冒犯賠償。","提出暫時或長久的結盟。","揭露古老或被遺忘的衝突。","引入新觀念或新儀式。","邀請一條龍參加重要儀式或活動。"]},
{"id":"gm-hazard-nature","title":"危機類型：自然","en":"Hazard Type: Nature","category":"hazards","kind":"譯文","source":{"book":"Epyllion 核心規則書","pages":"135","file":"core"},"paragraphs":["自然危機聚焦荒野與龍域龍族之間的緊張。龍依賴自然地景，但自然神祕、危險，也不願被馴服。有些龍能架起荒野與龍域的橋樑；另一些卻想征服土地，或為私利剝削它。","子類：開發（本能：剝削有價值的資源）；浩劫（本能：打亂現狀）；謎團（本能：提供誘人的線索）；庇護所（本能：保護神聖空間）。"],"bullets":["浪費地耗盡一項資源。","為危險問題懇求幫助。","摧毀公共地標。","改變、移動或重整一個地方。","用蟲獸滋生或獸群奔竄打亂日常生活。","召來新奇、神祕的事物。","釋出一項不受歡迎的祕密。","拿走某物並藏起來。"]},
{"id":"gm-hazard-moves-cast","title":"使出危機動作與建立角色陣容","en":"Making Hazard Moves · Hazard Cast","category":"hazards","kind":"譯文","source":{"book":"Epyllion 核心規則書","pages":"136","file":"core"},"paragraphs":["各類危機附帶的動作，是供你追求危機本能使用。每當有機會使出龍主動作，而且想強調危機對故事的影響，就可選其中一項。第 87 頁詳細說明何時有機會使用龍主動作。也別說出危機動作的名稱！直接使出，讓龍群回應故事裡正在發生的情境。","選好類型與子類，再加入新舊龍族！危機不是每場把龍群趕過去的匿名劇情，而是豐富環境，讓龍群探索龍域，途中發現自己是誰。為危機加入有趣角色陣容，每位都有計畫、謀略與欲望。","創造每個危機時，加入龍族角色陣容。可參考 NPC 章節（原文指向第 97 頁）關於職業、舉止與欲望的建議。有些細節能等見面時再填，但讓危機複雜化的職業與欲望，能替龍群開闢更多探索龍域的途徑。","例如與勇者參加攀雲比賽的小龍，可以是本地攀雲冠軍；但若牠是搖曳花園的管理者，龍群便能接觸龍域更多奇幻元素。"],"bullets":[]},
{"id":"gm-countdown-moons","title":"倒數之月：四個月相及其後果","en":"Countdown Moons · Moving the Moons Forward","category":"hazards","kind":"譯文","source":{"book":"Epyllion 核心規則書","pages":"137–138","file":"core"},"paragraphs":["危機的驅力若具有向前推進的勢頭——它計畫改變某事，而非守住既有事物——便為它建立倒數之月。月相提醒你危機想向前發展，也協助追蹤進度。四個階段是新月（行動漸起）、半月（轉變將至）、盈凸月（不可逆的改變）、滿月（命運實現）。","倒數階段追蹤龍群忽略危機、甚至令它惡化時，應發生的事。創造月相時，決定危機的命運：可能發生什麼？什麼受到威脅？龍域可能如何改變？","你可以把推進月相當成龍主動作，也可以在情境要求時推進，也就是寫在危機月旁的事情真的發生時。若故事發展比預期快，甚至可跳過階段。","在危機月周圍，記錄危機惡化時，龍群一定能察覺的明顯改變。每次月相前進，就在故事裡讓龍群看見變化。月相應是龍群無法直接控制的事件或事物；別預測其行動、把他們塞進特定場景。每個階段，描述的都是即使龍群不存在或拒絕介入，也會發生的行動。"],"bullets":["新月：危機正在累積，仍可逆轉。","半月：徵兆清楚、無法誤認。危機仍能阻止，但阻止的代價逐漸升高。","盈凸月：危機對龍域造成不可逆的影響。","滿月：危機的威脅或結果成真。龍域因它永遠改變，即使改變很小。"]},
{"id":"gm-countdown-example","title":"倒數之月範例：蠕貝獸與家族要塞","en":"Moving the Moons Forward · Wormolluscs","category":"hazards","kind":"譯文","source":{"book":"Epyllion 核心規則書","pages":"138–139","file":"core"},"paragraphs":["我有一個自然類型、浩劫子類的倒數之月，關於一群蠕貝獸（wormolluscs，會滾動的蠕蟲與軟體動物混合獸），威脅摧毀洛斯加家族的重要要塞。到目前為止，龍群還沒找出滿足其巨大食慾的方法。我已標記新月：『蠕貝獸幼蟲把巢移到採石場外的樹上。』龍群卻仍沒找到盟友，協助在不殺死牠們的情況下解決！","我的半月是：『蠕貝獸吃掉開採來建造要塞的石材。』龍群對年長的雷腹 Fayright『以下犯上』卻失手，我決定使出危機動作『浪費地耗盡一項資源』。蠕貝獸吞光全部石料，開始移向洛斯加要塞！情境已符合倒數的變化，我標記半月，開始思考預定的盈凸月：『蠕貝獸吃掉要塞西翼的石造地基！』","雷腹 Fayright 暴怒，蠕貝獸正威脅摧毀牠的一切成果。小龍在這場自然危機裡站哪邊？能否在更糟前阻止倒數？又能否不傷害蠕貝獸？","隨時可依故事最合適的發展，重寫、調整月相！某階段不再相關，就換成更有趣的事。但若龍群成功阻止危機，要讓英雄保有勝利；別只為阻止他們贏而改月相。"],"bullets":[]},
{"id":"gm-custom-moves","title":"自訂動作：火花、火焰與利害關係","en":"Custom Moves · More on Custom Moves","category":"hazards","kind":"譯文","source":{"book":"Epyllion 核心規則書","pages":"140–141","file":"core"},"paragraphs":["想進一步豐富危機，讓它真實、切身，可以加入一兩個自訂動作。這些不是給龍主用的；你已經有危機對應的龍主動作。自訂動作是給龍群的，提供新選項，以及參與危機的新方式。","動作通常有三部分：火花，『當 X 發生時……』；火焰，『……就 Y』，有時擲骰，有時直接產生結果；利害關係，若要擲骰，定義 10+、7–9 與 6− 的結果。","有擲骰的動作，10+ 一般表示事情對龍群順利；7–9 表示付出代價或承受複雜狀況；6− 則讓有趣、較不理想的事情發生。","範例：當你向蠕蟲精靈許諾時，擲 +魅力。10+：牠們贈你一袋聖土；為履行承諾而行動時，持續 +1，完成時標記經驗。7–9：牠們贈你一塊泥餅；吃下後，下一次擲骰 +1。失手：精靈懷疑你；牠們把黏土抹上你的吻部、施加詛咒，任何違背承諾的行動，持續 −1。","範例：當你朗讀《無名代理者傳奇》（Tales of the Unknown Agent）中的符文時，擲 +機巧。命中時，文字揭露你在龍域最渴望事物的位置。10+：可以標記一道暗影，再向龍主追問一題。失手：文字揭露你在即將到來的可怕事件中的命運。","動作可以很簡單，例如：『當你試圖對雷腹 Fayright 以下犯上，以魅力取代勇氣擲骰。』也可以像前述範例那樣複雜。不論形式，都應讓參與危機變得不同、有趣。盡量別設計阻止龍群做有趣事情的自訂動作！","想進一步閱讀自訂動作設計，可參考 Andrew Medeiros 與 Mark Diaz Truman《Urban Shadows》第十章〈The Shadows〉；其中整理許多利用 Apocalypse World 引擎創造自訂動作的資訊。不過要注意，這不是給小龍閱讀的書，含有成人語言與成熟主題。"],"bullets":[]},
{"id":"gm-hazards-darkness","title":"危機與黑暗","en":"Hazards & the Darkness","category":"hazards","kind":"譯文","source":{"book":"Epyllion 核心規則書","pages":"141","file":"core"},"paragraphs":["危機沒有『黑暗』這種類型。相反地，龍域的每一項威脅，都可能包含黑暗成分，成為黑暗潛入大小龍族心靈的入口……","最終，黑暗不是單靠牙與爪就能擊敗的邪惡實體，而是困苦與重擔強大到無法獨力克服後的顯現。Epyllion 的挑戰不是怪誕的邪惡，而是可能纏上、考驗與磨練任何龍族的危機。","若黑暗威脅在遊戲裡過於強勢，可能掩蓋龍群！別把黑暗當作萬用的『壞蛋』。多呈現人際戲劇與日常挑戰，揭露黑暗藏在每個人心中的地方。"],"bullets":[]},
{"id":"gm-festive-grudges-cast","title":"危機範例：節慶宿怨——衝突與角色","en":"Example: Festive Grudges · Cast","category":"hazards","kind":"譯文","source":{"book":"Epyllion 核心規則書","pages":"142","file":"core"},"paragraphs":["明天是飛翔節，兩位長老將分別在開幕與閉幕儀式接受表揚。不幸的是，兩位曾是親合龍群的成員，如今卻成敵人。第三位同伴去世後留下寶藏，雙方各繼承一半；現在，除非對方交出那一半，否則都拒絕出席。如果不能放下怨恨、達成共識，整個節慶都會毀掉！","類型：家庭（分離）。本能：分割一份寶藏或其他資源。","Swift Star：多年前已走過死亡之谷，把寶藏留給同伴 Vita 與 Tarscale。年齡：去世時為壯年鬚龍；家族：翡翠家族雪思可（Semscale）。","勇猛的 Vita（Vita the Fierce）：身形細長，一旦完全伸展，能環繞整座要塞。年齡：長老；家族：鑽石家族塔希絲（Tessith）；月亮：風暴；舉止：開朗、大嗓門，卻極力保護所有物；職業：議員；欲望：保護寶藏免受威脅。","溫暖的 Tarscale（Tarscale the Warm）：煙霧從鼻孔翻湧，肚子燒得深黑。年齡：長老；家族：黃金家族洛斯加（Rothscar）；月亮：虛無；舉止：對謎題興奮，卻容易分心；職業：寶藏精算師；欲望：讓寶藏恢復往日榮光。"],"bullets":[]},
{"id":"gm-festive-grudges-moons","title":"危機範例：節慶宿怨——月相與自訂動作","en":"Example: Festive Grudges · Phases of the Moon and Custom Moves","category":"hazards","kind":"譯文","source":{"book":"Epyllion 核心規則書","pages":"143","file":"core"},"paragraphs":["自訂動作——勇猛的 Vita 威風凜凜，氣勢超乎尋常。當你研讀勇猛的 Vita 時，以 +勇氣取代 +魅力擲骰。","自訂動作——當你在飛翔節展翅飛翔時，擲 +魅力。10+：你展示超越年齡的技藝，長老贈你禮物以示表揚。7–9：你令一位長老印象深刻；說明是誰，下次對牠以下犯上時 +1。失手：你的空中雜技惹出麻煩，留下大爛攤子要收拾。","危機備註：這個危機可能破壞龍域的一項傳統，但不代表龍群必須站在某個特定陣營。龍群有許多富創意的探索方式，包括選擇支持其中一位龍。"],"bullets":["新月：Tarscale 宣稱，除非取得 Vita 那一半寶藏，否則不參加節慶。","半月：商龍看爭端難解，決定離開、節省成本；他們離去，讓節慶更走向失敗。","盈凸月：節慶前夜，Vita 派小龍偷走 Tarscale 的寶藏。Tarscale 發現失竊後暴怒，取消節慶。","滿月：Vita 與 Tarscale 大打出手，互留傷疤；不光彩的爭鬥，永遠玷污 Swift Star 的記憶。"]}
]
